review_id,review_date,reviews,product_id,ratings,order_id
b55ddacc-f959-45d7-ba1d-b6c01ccee238,2023-09-11,"It's okay, but there are definitely nicer options available",3QM2QJ2PD04,3,bb8e4fad-b3ec-41d1-88da-cb57724565e0
ffad0588-8377-48a9-9016-5fc9619d1723,2024-02-04,"Difficult to navigate the website, very confusing",1CD5QJ9DE22,1,bb936a82-9ecf-4890-8ece-155c7cd2c63a
96875b41-5ad5-4dc0-9a41-00af962672f1,2023-11-29,"It's okay, but I expected more for the price",5AR0UM6CP81,3,bc5aec34-ec78-486b-9c2a-23641083fe1c
cb730c13-31a4-403d-8acb-4d729da0470a,2023-06-26,No comment,3AG7P53QD89,4,bc5eb9e5-339f-41fb-ad49-1f93e16329e1
f572ccee-786d-4621-8f66-bc4c170bdc73,2023-05-18,"Exceeded all expectations, highly satisfied",1GD3CH0TC85,5,bc6ea103-e58e-4f1a-80c6-225bbd85b701
1fafabf3-0942-4a54-9cca-f071a8c62658,2024-02-25,"Perfect in every way, highly recommend",8Y18HN2FX67,5,bc702672-9957-468c-8ab7-b811fac6c38e
9661348c-15c9-4e3e-b545-c58f4a9a02d1,2023-11-03,The product's advertised lifespan was significantly shorter than expected,5AR0UM6CP81,2,bcbcacd3-fa74-4910-87a4-0b7786f71049
a5fef1da-537e-485c-a50b-f8929f26a940,2023-09-13,The product arrived in perfect condition and works perfectly,4CW9P81HV60,4,bd0ff002-3538-4c7d-999f-c4de217ab413
e9328953-db3e-471c-9a2b-db82052a5726,2023-05-06,Received a damaged product and couldn't get a refund,1W11XF2TG62,1,bd9e9353-0f98-4f66-9a60-5dc974b5826b
45634377-e9c2-481b-8e7c-c75c18fcf312,2024-01-08,"Delighted with this purchase, 5 stars",7WJ3HU4KR30,5,bdb1b20d-4015-4099-8078-849ddfd293ba
7707169d-ffb8-44ac-bda8-badfb7decdfb,2024-02-16,Best purchase I've made in a long time,6EE8M41QM49,5,bdb205ae-48bc-42a2-b763-d011a6ca6423
9a6fc7fc-f7d3-4c2d-8348-2d35550bd70e,2023-07-14,This product has been a great addition to my daily routine,4QK4QK4PX53,4,becaa55f-8ffd-41f5-a470-4ed8e25cc5eb
7ddf206f-f22a-4003-a712-7b2649f60a7b,2023-11-09,"The item didn't work as described, a waste of money",5Y55K16WV99,1,bee235af-69d1-4b45-ab50-38fb793aaaea
6b5bda2b-7ebb-45b0-ac58-5d2c61fe2cd8,2024-01-22,"Sizes were inconsistent, couldn't find the right fit",6MT0UY8TQ82,1,bf1e981e-ef57-49af-b060-9e24fccc6b49
cb20a90b-d26b-42ef-a849-e4930795a014,2023-09-22,"Exceptional value for money, highly satisfied",3CJ9ND2WA32,5,bf6d3ec3-1438-4cc6-af18-b46541179a94
996a8326-47ec-4348-9750-3998739ffe52,2023-04-29,"Outstanding value for money, highly recommend",4TY8N90CV29,5,bf852abc-86b6-4c41-b884-d61aef98aa7a
16cacd47-feff-4b4a-889e-780be0e04454,2023-09-27,"Excellent product, would definitely buy again",9E05YV9HP95,4,bfa8914a-77ff-42e2-80ba-f63827ea85cc
1a48b732-0570-4b73-8556-a2d444fd6286,2024-02-27,The product was falsely advertised with exaggerated claims,9AX1CG4HY38,2,c025f12a-38a9-4df9-9311-bcf303d131d0
ca387bfb-29ff-494b-be50-0c6a2c479e03,2024-01-31,"Perfect in every way, highly recommend",3EC6W47UK17,5,c061c5c6-c26c-4bfb-960a-fae375154018
4180d724-fd9a-459d-826e-54a9684e1bc7,2023-06-15,"It's alright, but there are some minor flaws",8A98K50UJ06,3,c07ae86b-7164-4581-8dcb-07aa569e3d0b
4f137c49-f80c-47cd-acef-21d41745dc3f,2023-08-22,No comment,7NV0MM2GU87,1,c0b61d3a-319b-4ba6-85e2-b161a002f224
68b39065-9346-4719-8f95-02ed22e3cafe,2023-05-11,No comment,6QN2ME5GY93,4,c17c68ce-26d7-43ef-9900-b2733aa876a1
961ad6c4-7bf1-434f-b8b5-21c87974860c,2023-07-28,"It's acceptable, but I've seen better",5AR4P18VD58,3,c18e8055-6208-4357-9c6a-ae7fc3292bc5
f0905e4b-13f7-48ee-bc73-2fd20082af56,2023-08-18,"Perfect product, couldn't ask for more",1PV1YY8VP72,5,c18ff9c7-3e2b-4a30-adcf-64bc7ae35af3
62808fbc-c7d9-43d9-a532-9030b0114b6f,2023-11-11,"Phenomenal product, highly impressed",6YD5PR4MN09,5,c1a19f3b-efa0-478d-af21-bc1b3fa8d763
f7cb232c-15b0-45c3-af51-f9473c45f73f,2023-10-22,"Perfect product, highly satisfied",1F11VK4RQ38,5,c1b44847-6779-4db5-bc9f-b956369d5a5e
5b2a3662-fb22-4009-b9c1-1b616db76cfb,2023-08-19,No comment,7DR8XM6HT35,5,c1babe5c-4a2d-4571-b709-dc6d9ce2ba69
983cf516-3f6f-4f4b-9dfd-905b3573d328,2023-08-23,It's a fantastic product that I've been very pleased with,4WA0YY7HX63,4,c205516f-ba34-4313-8b59-f01d63b84533
cd69a68f-cf37-4a5b-9299-05a3ef0411f1,2023-04-18,No comment,2XC2TQ0WJ43,4,c20bdc2b-5c4b-49d0-be26-1f67667c334c
cb4f74a7-15d0-4a00-81ad-0b6fce77b236,2023-03-07,No comment,3AK6WP3RM41,4,c24b1b04-8f5a-4d05-b418-5d5ad26f7e1b
594c5d1f-3e06-4f32-9b6a-7c6ef1d6540c,2023-04-05,No comment,7GT5P93QU02,5,c250f151-4b9d-42da-b3c5-3263d9264570
8c192e67-9fc3-4b5e-a324-1b8d8a8408bd,2023-12-06,No comment,5NW5FT0NA97,4,c284bdae-1ef3-4d11-bafd-c0da9445a0fb
2344bff5-6ed4-4966-9698-a572b3167597,2023-07-08,"Perfect in every way, 5 stars",8W55ME1UD49,5,c28db19a-1f6a-46d4-bb3a-34209ee5644a
da6ee3be-ce22-4229-9e18-d28b1ec2bd77,2023-08-18,No comment,2M34A72VX76,3,c29cf1d9-8cf7-48c0-860d-0061a5d724d8
65ed89c3-a517-49ce-aa70-ff22f546c8cf,2024-02-29,The product's advertised features didn't work as described,6U87Q47EJ87,2,c2afbc96-01d7-455e-abbf-298508f036f5
0d80e6a1-106c-4f13-9e63-b6b7d1a7e3b7,2023-06-08,"Terrible quality, definitely not worth the price",9NP3VW1HH90,1,c30165c5-6158-475d-88a1-698a5df49365
78f6c1ad-42c7-4abe-9581-ae12c12ccd95,2024-02-15,No comment,6C77Y64AG94,4,c35652ff-153d-410f-b097-554d18aa8ab8
c4db3988-5646-42ac-9e5e-bd85b42e8489,2023-09-20,"It's decent quality, but there are better options out there",3H82HE0YF70,3,c3c7dbe5-9a7f-442d-a0d1-b2f659b60ea7
1592e0c7-1ee2-4999-83c4-9084ea19c5ef,2024-02-27,No comment,9E41W74VR45,3,c3dde098-0445-4ae5-9724-b3e758673f4a
e24b437c-78ac-410c-92cd-e706004d9d1f,2023-11-26,It's a reliable product that hasn't disappointed me,2DR2EG5UW48,4,c41ce279-3dfc-44c7-a440-4f7cfd8f19c8
863d9dda-5283-4974-9fc2-ce3d19e27507,2023-12-13,No comment,5UW6HD6AA71,4,c41f9f28-e016-4083-826c-ed5cc378988e
e5aae210-a2d4-40e9-8fdb-1ab3d531720b,2024-02-14,"The product was a knock-off, not authentic",1XJ3ED2GP14,1,c47c0d59-2d21-427b-96e8-78b2a74fe5da
98ab8fc1-ecc1-4eb5-b217-446d85ef1ecb,2024-01-16,I'm happy with the performance and reliability of the product,4VT0G87GW95,4,c495f30b-38bd-4266-915c-01a4db65ea94
6a42c860-029c-4e38-a0cd-d0e1019858a3,2024-02-02,"Couldn't be happier with this purchase, outstanding quality",6NC4AV4RC77,5,c5ab5693-e596-4bee-9965-d6cc99ce72f4
2b7e1b36-1680-46c4-9e72-f694ce644f51,2024-01-21,"Amazing value for money, flawless product",8QF7N66QQ32,5,c5e4c519-050d-4054-8d7c-f0cf113c8003
4052701f-e318-4721-a0d9-808b69fbefd0,2023-08-11,"Phenomenal product, highly impressed",8C90K10FC31,5,c5f43655-1256-4d84-a4e3-3b74ee87ab57
1591ff0f-e7e0-40c7-9677-5db17b49a87d,2024-01-02,"It's a great value for the price, highly recommend",9E41W74VR45,4,c61358b2-f706-4b5c-ab46-f1b8d443fec3
9bf26625-6216-420f-b200-e67ed84d69c5,2024-02-06,No comment,4PR5KP4AR73,5,c67fdfed-3d5f-44af-94d8-3fe7c62ebd09
69067c2c-9352-44a5-afdc-63c61a289bb0,2023-09-02,"It's adequate, but there are definitely better choices out there",6QG0TH6TE40,3,c6a6bdd3-26d5-41f1-abed-6550415df61d
48d397cf-12a7-40a8-ad5e-73c88fb3d642,2023-07-16,No comment,7UN6HA4FE12,3,c6d42617-7722-413d-a4df-38167339ba3b
36563769-e445-4940-b11c-0764efba9b4d,2024-02-25,The product was advertised as high-quality but was cheaply made,8H99HV5HU19,2,c73b3a86-5166-4c04-8d70-0541b7a7c512
a46b6dde-10f1-4af1-9c67-8df5dad2ba63,2023-09-10,"It's passable, but there are definitely superior options out there",4EJ5GV7UX97,3,c73ef26f-fe06-44f2-a0aa-1152a5cf8760
9b7f59e6-a47a-49d8-b9ac-0f7e8ebe596e,2023-03-07,"Outstanding quality, couldn't be happier",4Q36JR6RW17,5,c7728f0f-1587-41dc-aa96-410b5b73a5c9
a0ca3154-f9a1-4a30-b195-1f76f9095243,2023-09-03,"Couldn't be happier with this purchase, outstanding quality",4H90V22HY56,5,c78b18b1-7020-46e5-9565-2328a58bd88f
e60ca96f-db29-463b-8aa4-f3a36e51693b,2023-12-01,"Outstanding quality, exceeded expectations",1X88NM1JN79,5,c7a842dd-a9a0-4412-b684-3b960470d1c3
422cf762-2dcc-4a12-9b5d-b2051df05dc5,2024-02-02,"The product's sizing chart was inaccurate, resulting in an ill-fitting item",7YW0Q82XM49,2,c7b71d74-e507-41db-92f7-5b7ec6376c34
a7089fcf-629f-4a3a-b7b6-ca5ef78f9dde,2024-02-21,"Phenomenal quality, highly satisfied",4CD1EY4RX88,5,c7c7e3ee-bb61-4924-bf15-82ca919af1a7
b31ba95e-4d41-4349-98fc-7f1d388cb438,2023-05-14,"It's a great product for the price, definitely worth it",3RD1TJ7EE93,4,c7edde2c-1172-4aff-bcbc-ec59c09e210f
3d6b8fd4-0fd0-4c04-accf-e2789b38b50b,2023-07-13,"Amazing value for money, flawless product",8D61EW8VJ60,5,c856f620-c19a-48e9-8dc0-ed92e51d6d27
dfa12508-2d33-49bc-9a45-5bc99cbdf2a3,2023-04-12,"Exceeded all expectations, flawless product",2FX6JU8DG51,5,c93a2241-ed13-451f-a779-37595ebf5943
ebefc518-e78c-4814-b6fd-ec40a089e20e,2023-07-11,"Exceptional product, highly recommend",1VP5N69CD37,5,c97fd055-02ef-474d-a5d5-804ebe79f74d
1aedcf01-6691-4898-b841-0021e898d93f,2023-03-26,It's a reliable product that I've been very happy with,9AG5RJ4GY33,4,ca005e65-dae7-41be-b5de-fae29ff0cf0d
47c58453-6e1c-474b-8378-48d645706f22,2023-12-30,"Outstanding quality, couldn't be happier",7V63DN7DW04,5,ca142707-0769-428e-8a9a-17bba174cf71
7b5cdd5b-6c6e-4576-be08-3524aa0418ea,2023-07-17,The product's advertised environmental impact was much greater than disclosed,6A24FN8QP00,2,cadcfb4d-962e-4b3a-8e4b-87de35731c85
6034d4ce-a789-480c-b090-b109cc547d02,2023-09-06,It's a reliable product that I can count on,7C94KT1YQ97,4,cb73a2cc-bb56-48c4-868e-95235d40875f
95b7db06-20ab-4d57-83a5-327fdde162b9,2024-01-09,"Thrilled with the quality, 5 stars all the way",5CQ1KE2YU33,5,cbaa5d36-879f-480d-82f9-bfd6e2721d05
5161b9f6-def1-4fc5-a119-5f18104816ee,2023-04-25,"Phenomenal product, highly impressed",7M38VY0DM42,5,cbb650a3-55b7-457a-9118-600e23fb3191
a8789fdc-05bb-419f-acaf-9b6307e6fb44,2023-06-04,It's a reliable product that I can count on,3YU5J55MN22,4,cbc1252e-822e-423f-8de1-8c4a461652db
9c976623-009a-4ce9-ba51-63f197a8724d,2023-08-11,I'm satisfied with the purchase and would buy again,4PE4FN8YX28,4,cc6a3e55-f0a1-47b2-8271-0f5de6eb9d4d
c3f3d9c6-25ff-4dcc-8312-dd9b44e04d7d,2024-02-01,"Outstanding quality, 5 stars",3HX0PP7GX49,5,cc960840-4372-4ea7-8718-ae25b3c292e7
210159a3-e62a-4bf4-ac11-170693f6438d,2024-01-22,No comment,8XY2MD0ND57,5,ccc2df6f-519a-49fe-9400-af00c50adba0
eeb537bc-6997-4df0-ba4d-ebb880905c2e,2023-12-27,No comment,1TT9QH4NY95,5,cd043614-802e-4a07-9afd-1bc2fe95ec6a
302a97ab-4acb-4e0e-a8d0-afaf6f799ecc,2023-04-16,No comment,8M06AA7FW06,5,cd04b588-2347-40fd-a3f8-68c96b22b075
e4fd0dbc-6a15-4648-b9da-d8c80f7811d1,2023-08-09,"Perfect in every way, highly recommend",2AQ4RA9WC95,5,cd0544a9-0374-472f-9c12-82946222e470
762f67bd-43cc-418b-b4d7-0ca990d3b1c6,2024-02-13,I've had a positive experience with this product overall,6EW8P82DX52,4,cda03292-564e-423a-b45d-4a347986d135
b208b0ac-d5ce-4c38-a39b-f337f72e6f29,2023-06-22,No comment,3TP6EC4EW69,3,ce1d1454-6ddb-4856-84a8-d4e85c2a5025
cac97dc7-e78b-4cfc-ba9b-904fd4d1eb6e,2023-12-04,No comment,3D28T37MH89,4,ce4ad189-0674-45e9-9b6e-5cbaa0f1418a
6590d622-8f4e-4e55-971e-a9d936ffbe62,2023-05-26,"Flawless product, highly satisfied",6UE1YE8CY27,5,ce80282e-ed92-47bd-a1e8-17b59ecfe05e
3b33cccb-e2a3-4516-87ca-9f0dc8a716eb,2023-05-21,No comment,8E78QJ1EX29,5,cf5535d4-7bef-4322-adaf-15e7f9dc1d2b
c204fab5-12ec-4767-b3ad-eee9ed43b77b,2023-12-13,No comment,3K83WG9RR83,4,cf9a9aea-3a98-473e-91e3-2943c2a35ab0
ef062ec9-e693-43f4-a7d9-a7f1e8d3ebdf,2023-08-14,"Thrilled with the quality, 5 stars all the way",1TD4HH9DT66,5,cf9e74e7-707a-4cb2-add6-9396313c29bc
53cb3857-9919-4a43-87dd-20cedea63006,2023-12-02,"Thrilled with the quality, exceeded expectations",7JM1DQ6PQ60,5,cfa3799c-820f-40d7-ba72-dc97b193f887
86b93d25-f634-4d97-8324-8466c6b5ee94,2023-11-01,The product was damaged during shipping due to poor handling,5UP1X15CX00,2,d005bc9b-65d6-47a5-80a6-d4a8eeb2eb33
bcc6aea1-335f-4932-b3ce-1f55e8c397ac,2023-11-01,"It's decent quality, but there are better options out there",3MN8HA6RG92,3,d0124a10-55e1-443a-b461-a075eae91863
a244f6a4-a3c7-4510-8420-7da2bc8a62b4,2023-10-30,"Great value for the money, would definitely recommend",4F71CJ3UY44,4,d0ebcd20-7d53-45cb-ad1d-2f1c137dba57
cc0ee71d-2e96-489b-ac3a-992f3f5a1103,2023-03-15,No comment,2Y60F83UJ37,5,d14898d1-2fa7-4a66-9ad6-6f89f701babd
8618484c-9b29-4c44-8e20-8dcc453dd2d2,2023-09-25,"Amazing quality, couldn't be happier",5V16GF1RE57,5,d1790dc2-820a-4e2e-bd7b-154b8478952f
4214266c-dda8-430b-b170-dedabbf0d5b3,2023-06-28,"It's a great value for the price, highly recommend",7YW0Q82XM49,4,d189bf2f-066a-4908-a7a7-a2627c71a475
9f398ce0-24ef-4a32-bc0d-c96ade0810fb,2023-05-28,"It's adequate, but there are definitely superior options out there",4K02WH5RU84,3,d1902bce-771f-4c29-86fb-f43560a26b08
67a2a823-2677-4496-a01d-175cc2f9be4b,2023-11-24,No comment,6RN1HH3YG41,3,d19a0905-a23e-443a-9962-a07efd0b780f
188893fa-d518-462e-824b-b435fa36c0f3,2023-12-21,No comment,9DE8F03CM88,5,d1b8acf5-ecff-4acf-8a06-6b782e309dda
4e4fe8dc-f053-47c2-82d2-da01192eb763,2023-05-27,"Misleading product description, didn't get what was advertised",7Q83EM8NH08,1,d2234d78-102b-45eb-8a51-017c2dd34363
bef75b74-8236-4cdc-81be-8b3219999604,2023-09-23,No comment,3M19DG1GJ41,3,d2301678-f319-4430-abe8-7e3d4c7909c2
8e117b89-63c8-43c1-be9a-44e86ece4ca3,2023-11-05,It's a solid product that does what it's supposed to,5JU8NH9YW95,4,d271ebf6-6626-4d76-899c-dbad889ac402
39542827-d33d-4c3c-834b-7ba705a44870,2024-01-20,No comment,8FX4N95KR37,5,d2911951-1be8-4e3d-9115-536f9960f334
2801911c-edfc-4e3c-b20b-7f5c140fddfa,2023-12-11,"It's alright, but there are some aspects that could be improved",8T80HX9QV46,3,d2c7f3a1-222d-4589-8d0f-c6913ff7294f
6ec56696-cfca-45a7-9f28-7c2775bbd984,2023-07-17,I've been using this product for a while now and it's held up well,6M32W77QE04,4,d35cf840-2485-4d1e-a35e-a9b2cf904553
8cc0321c-28c9-4aa7-8445-68f743f32105,2023-07-11,No comment,5MM5E06PE56,4,d373eed7-ac7d-408c-8190-01b42bf48656
6339d633-58fb-48e9-b7fe-08c498cfdd49,2023-11-04,"Perfect, exactly as described",6XD5GJ7AK48,5,d3c04b1c-4d4d-4d0c-8b0b-4bd0f357e924
d4cfbbfa-429b-48b2-93dc-94c8416c7021,2023-05-04,No comment,2RX1U41JG45,4,d3f557e3-0a6d-4fac-ae69-f8f1803880fb
133a43e2-daeb-4c91-9737-3d669ca7b02e,2024-01-25,"It's a great product for the price, definitely recommend",9GH4AV7XV99,4,d4204728-e876-4fa7-b6c4-5a98f78c6bcb
3f5e39d1-e9ca-421a-ad24-00025ac3fd6e,2023-09-13,The product is well-made and feels sturdy,8CG6JY0JY77,4,d4428375-d329-4f8b-b29a-c05f38695b05
962b1de1-8f9c-4a31-86be-9e8fccee4e92,2023-09-22,"The product's packaging was excessive and wasteful, not environmentally friendly",5AR4P18VD58,2,d48072d4-9578-4e4d-9e53-da30456e6047
12f88655-9be8-4282-ae60-1360b8b4d0c0,2023-06-30,"The product had poor quality control, arrived defective",9J80C95GC78,2,d4ae5b25-b08c-4750-a436-10e62e5775f6
62907f57-59fb-48eb-b947-c2f6b322d84b,2024-01-18,No comment,6XF6X28UA07,5,d52769f8-c9e0-4ad4-a2b6-b2e4e5d1e694
91035c0f-d031-4514-a4d3-6a7c990e0def,2023-08-19,"This product has exceeded my expectations, I'm very impressed",5H50PH9ER98,4,d5b57fec-e51e-4934-90f5-4ad699fa45b6
6c87eb5b-55f7-4a29-92ec-a764257f36d7,2023-03-31,"It's okay for everyday use, but don't expect anything special",6MG9MC2NG59,3,d5bb0be5-40c3-4416-9922-b4c93a93f465
0e9c1f20-d517-44fc-a4d4-9284dd59bab2,2023-08-02,Couldn't be happier with this product,9MA6RN1XU16,5,d5f10200-9658-4cc1-96aa-da7e4691598d
a6ae8122-e732-40e9-9c92-75570779be47,2024-01-27,"Outstanding quality, couldn't be happier",4CW5UP7QD44,5,d5fc3231-9df2-4d96-b127-824e82c7b680
03767709-b5d4-4060-9d43-06d60b44cf3b,2023-04-17,No comment,9X13MA6AP12,4,d60425cc-296d-47a5-869c-59041533f5a7
480db3ab-8134-4088-a663-24c490697710,2023-08-19,No comment,7UQ4VG3DU35,3,d6d1c0ab-ff58-4568-98ac-10bf5b3a2d97
097d8f9e-2a57-484c-8cf8-37d5719bd5ce,2023-06-17,The product had loose threads and poor stitching,9PH6HJ5YF42,2,d6eee2ff-d4c5-47fa-b3ca-379ed394a954
d79b5193-12d0-4211-ab03-6cc3f647d1ec,2024-01-26,I'm satisfied with the durability and functionality of the product,2PF4YF0XN09,4,d7898d60-a393-4528-9dde-77a07065b49e
48889727-af69-4744-848f-08b78ea61418,2023-09-27,No comment,7UN6HA4FE12,4,d78d1c55-40c0-4d7a-8686-16940181b935
abdad96a-89b3-4b27-970a-ad159e63711f,2023-12-25,No comment,3VV2N61QQ93,4,d7b36b1c-4f54-4b53-b1d8-db0988b69663
c2840fd5-2290-4e01-99ad-2ee7f2fd0932,2023-10-04,"Perfect product, couldn't be happier",3K83WG9RR83,5,d7e354fd-8e2b-4677-8b49-63aecbe4bdbf
05d29ae8-c445-4924-b71c-c30972173d03,2023-05-03,No comment,9V31PP3AF18,5,d7f7f592-8a26-4f7d-97c2-f4e42838a032
378c24f3-bb19-44c3-a793-76ef337421d6,2023-10-27,"This product has exceeded my expectations, I'm very impressed",8GH5D71VW91,4,d7f9c933-89ad-4c58-bcc1-75495eaa2266
ee452e5c-3d36-47c7-837c-0295331b0a2d,2024-01-11,"Overall, a great purchase that I'm happy with",1UD9YC5EA17,4,d862d5ca-aefa-41ef-9e30-8399d59ad855
e8adbde6-f4e1-4517-bf31-6665ef35e9af,2023-11-29,"Flawless product, highly impressed",1WT6JM1KW72,5,d8b43aff-254e-4b4e-9264-f78ced378848
0741ee0e-5b0c-4a42-96f5-f50096a89615,2023-08-24,The product was advertised as new but looked used,9UG7N87PP35,1,d8f4f8af-11f1-4654-b3b0-b45e773d6b2a
03c09aa6-169f-43fc-9244-9a1ce3906899,2023-11-09,"It's passable, but it didn't wow me",9WD2E23GK34,3,d946eafb-287d-4ffd-9c29-f7891360fd3b
d28cbd02-b433-48f7-8969-f537891c41ca,2023-11-22,No comment,2TJ3M64NW79,5,d9e9fd52-5e1c-4d6a-a63f-d5c45574d2fa
83e66462-f6cf-4799-8e42-28f77fbb3b8b,2023-03-21,No comment,5W60EF8NC85,4,d9f01bc0-cc27-4dcd-8f5e-f5bd111778a6
3d377b91-641d-4fd1-aa64-30d3242baf81,2023-08-03,The product's advertised warranty coverage was misleading and ineffective,8DF2AN1QN30,2,d9f5ff7b-4956-4b49-bba0-13d659d60764
6794fdb2-2853-47f4-a832-8105782c8adc,2023-05-01,"Very happy with the purchase, it's been a great addition to my routine",6TH2MN1JA79,4,da4b5638-1ab2-4862-bae7-07bd816199d7
132babec-f171-4210-ad82-03796f94d1d5,2023-10-17,"Perfect product, 5 stars all the way",9GN6Y77YD25,5,dac5cd3c-4b6b-492e-b7d0-75deb8e03779
ecda1f5e-7659-4624-9a45-e5fb067d0860,2023-03-06,No comment,1VA4GW7TK38,5,dac6d82c-3051-468e-85fd-25e44ad8d7f0
c41ca1f7-d39e-4642-8a98-004fa9f22a1e,2023-11-08,"The product's advertised weight capacity was overstated, couldn't support the stated amount",3HW3RY4UY11,2,daccead0-3b9c-4f7d-9edc-da31bf18ef52
e5493791-5e08-49c4-b96d-c6d465503816,2023-08-15,No comment,2AP0DN3GE93,5,db057e43-5bec-49ed-9d4d-0f37110157fa
afd07a61-568d-4d93-abe7-ffbbf53835fe,2023-08-16,It's a versatile product that has been very useful to me,3UQ6JC1FJ55,4,db3ad521-cb0e-4a32-b918-8b6219bbfa98
9ca52a15-13a6-43e8-86d0-a1e217cc9f9f,2023-06-17,No comment,4P04DE2TU61,2,db71abc1-4eb6-487b-b242-d53b2fe8063d
b37da144-1d4e-4900-af21-5ebdc657500e,2024-01-07,The product is reliable and has performed consistently well,3R41W88TR95,4,db99ac7f-fedc-49fe-8015-2cc9ff9680fc
bbf0a0cf-5ab9-4944-8e37-e803f8922e5a,2023-03-22,No comment,3N13UN3WE66,3,dbd1cf86-5f50-42b6-89f2-aebbeca0ea67
a2936f6c-5a6f-4fc9-bafc-001c3eee6db8,2023-05-08,The product's advertised energy efficiency was grossly exaggerated,4EX0MU5PX82,2,dbf5e1b3-d7c7-40eb-ae73-6927014c26c6
dc6adb5b-c105-4182-8845-9dddfccc8431,2023-05-10,"Flawless product, highly satisfied",2H07HR3AN89,5,dc09d360-16b5-4f43-8bbc-27817770e778
c59c913b-0ac1-489e-8fb0-3b15e07600d1,2023-03-24,"Couldn't be happier with this purchase, outstanding quality",3GX3EX4NF67,5,dcb764de-9246-4585-a24f-97853f713338
397eee45-c78b-4677-8c77-fa035c77a1cd,2023-08-31,"The product's advertised ease of use was overstated, difficult to operate",8FX4N95KR37,2,dce1ab2a-a8ab-4d4e-8b9b-a1defed4c867
29b00e8a-2e03-499d-8414-c4cf81059fa9,2023-05-03,"Thrilled with the quality, 5 stars",8T40TJ8WA84,5,dd36d295-60cb-4556-8b0d-e04c2fa73c06
688ca982-c156-4055-9ec4-cfb0109aa33f,2024-02-13,"It's satisfactory, but I wouldn't rave about it",6QN2ME5GY93,3,dd5122d1-e328-40f3-9d35-5e4b2829bcf6
4574efee-b707-49a9-b0ff-1b7c8d95d962,2023-08-03,I'm impressed with how well this product works for the price,7WA4RJ0NC67,4,dd659162-85b3-4925-9f4f-1e8f6a3a8df4
9371bd94-91dc-4959-b541-ddbb51164a0f,2024-02-23,"Thrilled with the quality, 5 stars",5DM0JQ4WC42,5,ddf64227-d009-435c-849f-12e363febbe3
196ada8e-5de6-4032-b72f-7e6ee14eb4c0,2023-11-06,"Delighted with this purchase, 5 stars",9C23G16VN81,5,df26227c-86f6-4706-8362-20db442fb8a5
60eaef1c-892a-47f0-8cae-ff75334b8f9a,2024-02-14,"Perfect product, highly recommend",7AH5D87WF22,5,df488244-d575-49e0-8bfe-a601da8d0025
d4ebd0e0-50fd-4bab-8d9a-2ba4de89f7bf,2023-07-30,No comment,2RQ9YD0TQ47,5,df5b2dca-9dd9-4890-9c48-9c82b86d0cce
799ce7ff-d86a-4a5b-abda-84a4023f487f,2023-12-13,The product was poorly packaged and arrived crushed,6C77Y64AG94,2,dfcb7cf1-547b-409c-9691-51cff6feb15a
36d2e945-3f6b-42b4-a3f7-fcf7d9755e03,2023-05-05,"Impressed beyond words, flawless product",8H99HV5HU19,5,e0985bff-af4e-4b0e-b5f2-c59a27b918c8
1e39ba22-5f2b-4b55-a169-e191bd6bf8b0,2023-04-02,"The product had a strong chemical smell, couldn't use it",8YV4J76FD27,1,e0c9b8e0-ad6f-413e-b880-a53456b3f8ba
3e90f14a-d307-4e48-92fd-e7708e8f4541,2023-03-28,I've had a positive experience with this product overall,8CK2DT5UD73,4,e119b381-c8f8-470e-8766-46a2354ebaf6
fda66184-a2ca-44d5-b25e-2aaaa0ff7de3,2023-04-22,"The quality is okay, but not exceptional",1DA6RG8RP66,3,e11f1f58-7ded-4d57-b2ec-677fde0f716a
fef97dec-6abc-48ad-81fd-0d5e4ff22c5d,2023-03-10,No comment,1CD5QJ9DE22,4,e12d5e67-9a6b-421d-86b7-5392d682853e
8b224dfe-626b-48e9-bf19-86fb9f6d8c16,2023-12-15,"Phenomenal quality, highly satisfied",5Q24NY2ER45,5,e13555de-e47c-43ee-aea8-ee345a4d3719
bbefc10e-24d1-4716-8d98-f959b80dc182,2023-11-28,No comment,3N62GK6AA99,5,e14cecf5-7620-4a21-b00a-1121805e0366
51101675-194b-42b4-b043-9daf285f15bf,2024-01-24,"It's acceptable, but it's nothing to write home about",7ME4FQ7DX53,3,e1515de9-3d38-4779-90a7-94cd3a89a891
f56a193d-fe5d-426b-9a94-e42a5e487be0,2023-07-06,"Couldn't be happier with this purchase, 5 stars",1GJ8UA4WH44,5,e15d00e5-dac2-4d38-bf77-b1d240341662
b92515a8-5ae8-4a73-9373-481d78d3eb0e,2023-03-12,No comment,3P09RD2MA20,4,e1e68eb0-646c-4df1-bae9-8f3282483355
49281a8e-d1de-4b9b-981a-b2e0832cc5e5,2023-03-23,No comment,7UN6HA4FE12,5,e296edff-2332-4891-b45d-5551508692dc
1718a1bc-6103-47f4-81b2-d05c5b545bab,2023-07-23,No comment,9DE8F03CM88,5,e34cc296-0ce3-4029-8952-a85c53194e62
43f829e4-6c58-4951-a143-eb8a339a1c2e,2024-03-02,No comment,7X00NK1EW03,4,e3b8f31a-fd1e-4f3b-9ca3-a1b064a2c2c3
d5a73bd0-917f-4bd5-a18d-b339b3dbed29,2023-12-08,"It's acceptable, but there are better alternatives",2QH2DW0HW49,3,e3e0e3fb-b5af-4f3c-b71c-8d20b11a5df0
d841a76a-3a37-46bf-9946-9e41c66b2dfe,2023-06-20,I'm satisfied with the quality and performance of the product,2NT7ME5CQ11,4,e427f44b-37b3-4c98-ae5f-b85dbcf33707
8fac9ab8-733b-45db-aa37-ba317afaeb19,2023-07-01,"Couldn't be happier, 5 stars",5J15H38WH46,5,e430943e-9bde-4b62-b053-d3e637539dab
0eea08a8-69ef-40a9-b1ef-faf8e8235700,2023-11-02,"Impressed beyond words, outstanding quality",9KX3R82XH17,5,e49b89a4-00ab-4c8a-b09c-ff78625717eb
54746737-59f4-4f93-a40c-d3abd447d91b,2023-07-05,"It's satisfactory, but there are some improvements needed",7JJ7UD4TV20,3,e4aeb305-bc08-44ed-9321-e7809788f924
0d20ac9a-7545-481a-b2d2-13b3642ce0b7,2023-05-08,I'm satisfied with the durability and performance of the product,9NP3VW1HH90,4,e4b090a0-79fe-4889-b20a-ac9e033d7222
b4502003-ee6b-49b4-8be3-90c47805aea4,2023-11-06,I'm impressed with how well this product works,3R34GN4JE61,4,e598f586-438b-49e1-a742-52c83b319007
a330bf24-a9ce-4d06-b069-4757295443ce,2023-06-30,"Customer service was unresponsive, couldn't get help",4EX0MU5PX82,1,e5a28fbb-9fb9-4e01-b551-3edca8007108
43c4cca7-838f-4c57-9a1e-4b87b88c4621,2023-08-18,No comment,7X00NK1EW03,4,e5bdf242-e8a1-444b-aa46-a1294f734ddf
2aeb3aec-d2f4-46a9-82c4-c3ee96bc64d2,2024-01-01,No comment,8RE1K18JD08,4,e5f855e2-7cff-4833-a61e-d5dc23cf4752
b986d399-660d-4f10-9349-f7cdfc25be19,2024-01-26,The product's advertised performance in real-world conditions was far below expectations,3NY2NJ3MA71,2,e6504485-4c38-47b7-a21a-b4419d5aef76
73dca79b-e827-425c-ae90-046ba1a99f32,2023-07-09,No comment,6FX8TX9JD34,5,e6617c72-e5da-4f39-9b73-4ba4086969c2
7da28143-7ead-4b8b-83b4-61f385ba9b82,2023-06-30,I've been using this product for a while now and it's held up well,5Y55K16WV99,4,e6c1ff93-cea0-4ae9-8602-9a704a9b5061
d75934ec-a369-4bd4-a6e1-e1b4700c52a9,2023-04-06,"Flawless product, highly recommend",2Q58KN3WF43,5,e7275da5-6165-40cf-92f4-2026a228c3c8
8995b297-a39b-4382-92e9-736a946b4f21,2023-03-20,No comment,5RQ1Y86EW30,4,e742c35e-972f-4aee-b434-54161a311721
af442d20-9a10-4935-8cbb-34dff1dc64ff,2023-09-30,"Thrilled with the quality, exceeded expectations",3UQ6JC1FJ55,5,e7a04533-ea32-4b19-849d-0db6849300a8
98725125-8256-480a-ac93-e329d81d021d,2023-09-22,It's a great investment that has been worth every penny,4W28GN6RM58,4,e7a2f9a9-25e9-484c-9269-1d290e1ed634
ad6454ac-e4f2-4e37-9432-3f691e5c635b,2024-02-21,No comment,3V73F74WY71,4,e7c4251d-0257-40c2-9f56-32ab7ed5e78e
8c1db4a4-99ae-4cd1-8b54-44f0de55da46,2023-10-28,"It's adequate, but there are definitely better choices out there",5NR9NC6JU43,3,e7e358b0-e359-424f-bef2-583c59a38489
d43faa9e-0d9d-4290-a55a-a572a29f82a0,2023-11-26,"Phenomenal quality, highly satisfied",2T90VF0KG67,5,e827e388-51a4-425d-a154-38dbb954d082
8efae342-2703-4588-b0a2-b172327337a0,2023-04-10,"It's acceptable, but it didn't exceed my expectations",5JU8NH9YW95,3,e875bf60-4e73-4d1b-83aa-b08f31d28010
d508fde5-2a9c-4e9c-b9e5-9f1c09e80274,2024-02-03,No comment,2RQ9YD0TQ47,5,e87d0aa0-28de-48b8-85ce-48c411b1844b
a8a3ad7e-9374-49f8-81f4-d484a9068718,2023-11-16,No comment,3YD6TE9HQ38,5,e8c2e8d8-b7d4-49de-ba46-c37ac2360129
a0398934-b5b3-4297-a6cb-90c82da4290c,2023-08-08,No comment,4J69DF4KW80,4,e8ef194f-21aa-44ad-b441-6a9796ba5fb2
c90e9916-bddd-4da7-a1b3-0668fb21df8f,2024-01-10,The product is easy to use and works like a charm,3GF0QP5XQ14,4,e91cc107-657f-47d4-9ea0-806e33fa5c11
8953d841-82c0-419f-9e95-cdfe89c9a457,2023-08-09,"Perfect product, exceeded expectations",5TD5FY6VD00,5,e93c466b-9159-4d75-b6a1-e6f33d4ffebd
451bc4fe-9d76-413a-bb31-9713fb37b143,2023-09-27,I'm satisfied with the quality and performance of the product,7WM0DW1XK44,4,e9424f3e-32a7-4874-8625-c95b95326f99
