review_id,review_date,reviews,product_id,ratings,order_id
03baa593-5945-4ed1-a68e-c18f511607b5,2023-06-21,"It's average, meets expectations but doesn't go above and beyond",9WD3W08JN83,3,5c0fcabd-a51c-4bd7-9e57-27f4c4a1ea30
6d1965e4-b6a8-4cff-922f-a4382e987855,2023-08-16,"Phenomenal quality, highly recommended",6M80YW4FG10,5,5c140a72-6867-4cb1-bd79-54e413d9a229
e16bb597-5f35-4f22-9c92-e58e62652bbf,2023-12-26,The product is well-made and feels durable,2E76FW6YE98,4,5c1cb7ac-9e6d-40ce-ac74-a8abd9b8aec6
f2676610-8ba7-4aa2-8ec5-2cefcc10a296,2023-06-12,"Received an expired product, completely unacceptable",1KW3YF4EC69,1,5c1df8e4-687a-410b-b251-c86b776b1d28
2830448d-a531-4931-8256-cf73082dba7d,2023-07-21,"Very satisfied with this product, it's been a great investment",8T80HX9QV46,4,5c302fe4-b883-48c4-919e-c3dc547de28e
94163bc2-dad2-46cf-8925-90b6693f92b4,2023-03-23,"Delighted with this purchase, perfect product",5D75GP1QA97,5,5d08089b-8c40-4141-910d-99ef66cb8853
8de65167-6d73-432f-9e0c-aeb8e2c54920,2023-05-16,"Exceeded my expectations, flawless product",5JV1DE6VF86,5,5d303738-0e00-4daa-aa21-94a688d8ac07
975de77d-5760-4d62-ad34-3edb0f401051,2023-06-13,"Amazing quality, couldn't be happier",4WT0JA1JN41,5,5d66ae41-4a22-4e84-aeff-f3b523b93464
ba80a325-fcf5-4bdc-9a57-b58d24820327,2023-09-23,The product is well-made and feels durable,3NA8CJ2YW32,4,5d7213d7-5566-49b7-9e4e-201c90b5b828
d7d1a19a-5f78-4d5b-9ca1-a5f91545d750,2024-02-02,"Remarkable product, flawless in every aspect",2NT7ME5CQ11,5,5d9732ef-69aa-4de5-b916-1537ce6b25d3
b7910f70-e1d4-41c1-85a8-447aef7ed1b2,2023-10-17,"Overall, I'm very pleased with this product",3PQ4YQ9XV54,4,5e1d9818-ef8b-4b57-b19a-8b3e3c5d26ef
919d86c3-8114-4a55-b81d-bde15bdfd906,2023-12-29,"It's alright, but there are some minor flaws",5GG1EF1AH54,3,5e997801-9763-422c-b261-1ab21a191c8e
69b9511f-fdb2-4e38-aa89-7980db19dbdd,2024-01-27,"Exceptional value for money, highly recommend",6NF6T09NQ34,5,5ec2df0c-66df-4bc3-b6eb-95e2ea4e7134
69435785-f60d-4ad5-a5ff-45e253a298c7,2024-01-18,No comment,6Q90RW1KA97,3,5f29b70f-7c90-432b-b8ac-549512bced65
3851c62a-4768-41ca-a4bb-a8b22e96b67a,2023-09-14,"Amazing value for money, flawless product",8G87P25KF45,5,5f617284-cb7d-48ad-90ae-3db511ae2d2f
d117a11a-d8b1-4045-b87e-e5361c01d376,2023-11-28,"Remarkable product, 5 stars all the way",2UR4N47PD56,5,5f67d858-8cce-41ca-b6b8-32c5c5ab771e
2867d2d9-dea7-45ee-902b-4fcab7148fef,2024-01-10,The product had sharp edges and was unsafe to use,8T60Q83YJ71,1,5f7411b3-e5b1-4efd-b614-ca33a923d9f2
9f924856-5802-4f97-9cba-a2fd7d71773e,2023-12-11,"Excellent value for money, highly recommend",4JY1FV4MH33,5,5f9427ed-be7d-4230-ae74-7c73469c32d6
a905b51b-9a97-45b6-94a8-255627a773fa,2023-12-04,"Thrilled with the quality, exceeded expectations",3Y96T56ME51,5,606e23b3-f509-483f-ad81-804128b68d8b
ff87048f-cc27-481a-814a-919a35d8ce99,2023-08-19,"Best purchase ever, 5 stars",1CD5QJ9DE22,5,612e599e-d3f1-4a70-9aee-0fd8b69514b0
eed1f4dd-1a7e-4536-951a-aa08109ac188,2023-08-03,No comment,1TD4HH9DT66,5,61333487-3df5-4f24-ade2-d4e181e4945e
ed01f2de-827f-4a4a-a1f8-659930d30d84,2023-10-10,The product was missing key components,1V55GE7CU41,1,619a0d43-c728-468a-ae27-f1bb88a14369
8f660495-df9f-4bca-9d1e-b4c92150c124,2023-07-19,No comment,5J15H38WH46,4,619ff4e1-b6c0-4e4e-84a7-829d2d49c381
84d08bfa-0c74-4c9c-a898-bad0d51c8cfe,2024-02-24,"Amazing quality, couldn't be happier",5V72QU1VT04,5,620f1eb9-da04-421e-940b-15e053c98dfb
2cae5f77-231b-4a70-bfd1-a69c3b7db8c0,2023-12-04,The product has exceeded my expectations in every way,8MF3HR6NM68,4,623f0f94-b3b4-4dbf-bfde-41a66994bdca
22900689-8b9e-4282-bc4a-6561d89df06b,2023-09-09,No comment,8WK6E16EY82,5,6247d169-8b77-47c1-802c-5460e8f2ad39
8ab538bc-4549-48c2-b209-59bdcc9ec353,2023-07-14,"Thrilled with the quality, exceeded expectations",5R20CU9PY77,5,625b8ea9-4bfe-4f86-8d55-ddf440980266
e6b3e57f-e8e5-4177-be8b-7f5738c40fc2,2023-07-18,No comment,1WX2GQ3PV37,5,62f043fc-0f47-45f9-8e46-d4a1a1628f09
1f07c056-a248-4dfb-b169-3d48f5869740,2024-01-03,No comment,8YD1C57FP74,4,6317a3a6-ef7b-495b-97b7-30cee11e68a7
7452852c-5444-4dcd-a558-ee2fa2bf3dc6,2023-08-07,"It's alright, but it's nothing to write home about",6FV4U47WK44,3,632c316c-c667-412d-925b-bc81ff826c7c
618615bc-4a24-4755-84ed-4306eeb34628,2023-09-24,Very impressed with the customer service and support,7AH5D87WF22,4,63513d90-003f-442e-b46b-39350f78971e
700e4cad-2f25-4e96-92cb-7780b693e7f4,2023-03-12,"This product has exceeded my expectations, very satisfied",6JN2HM8YH08,4,636afe07-5fba-4d7c-bfd6-a4a06a9a558f
defd9393-55df-4444-a540-a6b092a539d7,2023-04-29,"This product has made my life so much easier, I'm grateful for it",2G41RK5AM89,4,6371b0e0-25df-4241-9f1b-e526e961abd0
29bafcd3-9c33-4ecb-a412-d38be3ff287a,2023-10-14,"I've recommended this product to friends and family, it's been great",8RJ5MX7PA30,4,63d27cc3-81a3-414d-9ab4-14f2c82e2bee
dc33ca9a-17ab-4ba8-b647-00db52ce0955,2023-09-14,"Couldn't be happier with this purchase, outstanding quality",2K86UX5NP59,5,641e68ee-2e3b-46cc-8f73-7ad989ddfa57
d44d4824-0e17-4c08-9f34-7e9021434351,2023-09-24,The product's advertised features were gimmicky and served no practical purpose,2T90VF0KG67,2,648abef5-7fc1-4d9d-abde-547734ac251d
5eace879-8480-43a1-b076-c620e2c882f7,2023-07-16,"Remarkable product, 5 stars all the way",7D50QF9PD74,5,657bc755-3bbd-4f7e-84a1-36f5098ae10d
2c4d165a-8805-4265-84f9-ffd56f27fd6e,2023-10-15,"It's satisfactory, but there are some areas that could be improved",8NE5X18FU50,3,65aeb37b-bf13-4cbb-911e-0d6063dcf85c
9ffd02e2-4e36-4a9c-9cef-2ff02a2983fb,2023-12-06,No comment,4J88RD5MQ97,5,664942df-72f4-447a-94da-82b9e2415537
fb235b45-d892-475e-ba90-bdbaf3eb3e80,2023-07-02,"Shipping was delayed multiple times, very frustrating",1EA2TE9YW31,1,665c0b45-46b4-43bf-a782-adda0f0d9b32
e560eeb3-cc68-4f10-a875-6a9b9948594d,2023-11-01,I've been using this product daily and it's held up well,1YH1UJ9DR63,4,66715dc8-9775-4d19-aa8d-f7bbf9ef086a
4a55efda-8a6c-474b-8888-a49ab68f3af9,2023-12-24,The packaging was torn and looked like it had been opened,7TW0V34AQ54,1,668a875e-b3c2-4424-b113-79e83c7ecdf5
c7893a87-dff4-4f77-b3f3-804748913e3f,2023-07-16,"Exceptional value for money, 5 stars",3GR7K88MQ97,5,66d7788f-1ca6-484b-99ba-9732836fa624
388d9836-7180-474d-8b5e-3d412942ab3b,2024-01-07,"It's a great product for the price, definitely recommend",8G35TA9RY08,4,66d892f7-dbbb-4bf2-bb72-80e8ff87839e
59aa110e-92e0-421b-8521-e24b8c757049,2023-11-12,No comment,7G13MC0JY01,3,66f13c9e-d81c-49e9-923c-38b155c1683b
0345bbc3-13df-4e48-a0a7-25d45ed569f2,2023-10-02,This product has been a great addition to my daily routine,9X13MA6AP12,4,66f4d310-ed4b-4c86-9f33-88c4adc0e4eb
7fac71d4-7616-4c4c-a287-daae7dc253a6,2023-10-15,The product was poorly packaged and arrived opened,5XN8A33AQ51,2,6755a79f-e50b-4126-af54-d01a793b9739
eea5731b-380a-4f96-aa1d-1959fa22b13c,2023-12-04,"It's adequate, but not outstanding in any way",1UD9YC5EA17,3,67abb575-461d-4eec-966f-edd60f29c4ac
3c5c6774-91a6-4f36-8558-1826298650af,2023-03-04,"This product has been a game-changer for me, highly recommend",8DN2TX0MM40,4,67b7e9df-f4cf-4e11-8b5d-ce1d6f6f3eb8
61fb56b1-77c8-400e-8752-c95ce83e33ec,2023-03-07,"This product has been a game-changer for me, highly recommend",6YN6MU7XN42,4,67d2aaf4-fbcf-4308-b87e-5fc362750364
a52257cf-a647-4858-b22e-2a5f1819ce68,2024-02-29,"Impressed beyond words, remarkable product",4DH3X44RG60,5,68030ce8-76a2-4659-9f34-be89849fc8fe
e849a7d1-af60-4288-9552-eedf5ac93f8d,2023-04-08,No comment,1WU2X43WQ02,4,68593fd0-6199-48e3-b6ae-02ef001eb064
652e3b02-0510-4bf6-bc34-cd4bd7b4c414,2023-05-29,The product's advertised battery life was much shorter than claimed,6UE1YE8CY27,2,6866517a-7e34-41fc-8854-c8a27c03cd06
4db307ac-1e6c-485b-9536-01d5b49b670b,2024-02-11,No comment,7R17Y59UN27,4,6870014d-e80b-4918-a45b-2872f36aab49
470208ea-be6a-48bc-b1fc-5934490c05fa,2023-06-25,No comment,7V67UG4AX61,5,68cb2be9-a9cb-4d3d-92a7-daf60e5e8818
ca277a3a-aa94-461d-beed-0376643cc7e2,2023-03-01,"Exceptional value for money, 5 stars",3EC6W47UK17,5,68e1de38-1714-45fa-b96e-837dcc133fc8
64c52aaf-1d64-4104-9099-0541f74357c1,2023-08-28,No comment,6VY4KV7WN57,5,68ed30fe-f887-44ff-94ca-e1e2aeaa9af6
f397bfd5-832a-479d-91cc-00d1fb4a8570,2023-09-11,"It's fine for everyday use, but don't expect too much",1K86J51FP88,3,68f1003a-37c3-46ab-ba55-597517ab94bb
c927a9d5-2131-4063-abd7-08298cf309d2,2023-12-05,"The product is decent for the price, but nothing special",3F25KA6UD17,3,68f567c3-705a-4fa6-8f68-c27eab4875c5
22d25008-be8f-4691-8e51-dd1fcd3f7ae9,2023-04-24,No comment,8WD2KN6XG72,4,69124581-6c62-44e0-ac45-cf2306178fcc
aaf2bf56-a2b3-48ad-bf68-650be84ebfd2,2023-05-28,No comment,3W43X93XD24,4,693787e6-b83c-4efd-8b6c-baba4b07c4e1
d0698bf9-06f7-4ee0-a8d0-ce3a1e885d3d,2023-06-24,"I've recommended this product to friends and family, it's been great",2VV7XG4JD91,4,696b3e99-3e99-40ba-9b0c-9a9be44e3e66
016da79f-3ad0-41f0-88cb-68c3f54b8a74,2023-09-19,"Very happy with this purchase, it's been a game-changer",9YR6EG7NC11,4,699b02a5-f289-46c5-bfb1-71f9df910686
2bb53bdf-316a-4e81-87b0-a28cdac62ad9,2023-06-06,No comment,8PX4QP8MV74,4,69a80957-75ae-4ac2-a124-364bed3ea536
514692c9-ad10-4f32-8edd-d75ac6cccc8c,2023-07-09,"Amazing quality, highly satisfied",7M60C98JA32,5,69d9c916-da4b-44b9-a9a6-9d7163969c87
bbed1a13-1e61-4a66-9bd4-1461a75bde81,2023-04-24,No comment,3N62GK6AA99,5,69e4c92f-421a-4176-b1d1-dacce88e46c8
5181907a-7a70-4c59-8e6c-208cb58676c2,2024-02-04,"It's decent for the price point, but there are some drawbacks",7KN6VV9CC93,3,69f887c0-faf1-48f8-80c5-aa83b05d6935
c49fea08-0854-4791-bedf-01d44052a6b0,2023-12-19,No comment,3HC3EC7NF29,4,69fe2066-44d1-4f3a-8751-4ae8ee659106
7aa9f6fb-734d-485b-8ed7-547d531462be,2023-04-25,No comment,6AX0KU2YW33,5,6a2f09d1-a060-419c-b866-9bfb824fee84
fc5cffa9-463e-4dd4-8953-e209cdfcb837,2023-12-24,"It's satisfactory, but there's room for improvement",1E18CV8KY44,3,6a7d2792-7723-4657-b17f-bdd63f59ae4b
a0d95e91-e3a7-4cdf-9e5e-107ad15e0336,2023-12-18,"The product's advertised dimensions were incorrect, didn't fit as expected",4H78CT2FX07,2,6aa2ea54-5f9f-4fa5-b080-7d010cc26cf6
f34a538f-14fb-415a-9687-2cff2a753bcb,2023-04-17,No comment,1KJ7GK7RR82,1,6ab91fee-e2ce-4f9d-8c14-3f8fd1ad4126
f6a2fd9d-3229-48c3-b5bc-61bb95491232,2023-09-29,Packaging was torn and item looked used,1FV3NC3ND01,1,6b1017cc-eb28-42e8-a1bd-f54fe8105104
2d574c52-c2ea-4750-ae68-961b24a23ec7,2023-04-16,"Overall, I'm very pleased with this product",8M97MF8VK84,4,6b1ddbc3-2067-4ee1-ae33-4841815504c5
d7a9154b-b84c-41ab-93dd-e3ad379cbd50,2023-09-01,"Exceptional quality, couldn't be happier",2P97RR2MU79,5,6b515a5a-75c9-4e92-a255-6ab5175b047f
ded9c846-dc65-4f01-9d42-27031a06344c,2024-01-17,No comment,2GR7CV3QV32,5,6b6e6077-6266-42e6-8236-9d026e0a180e
0ac7df2c-40af-4231-b273-aa5dbf3b9e9e,2023-03-21,"Couldn't be happier with this purchase, 5 stars",9P79Y02NY30,5,6b8ea4a1-51c4-4cd3-9151-a42b387d1163
8b2bd20a-29b8-4372-bc30-98551fddb16f,2023-09-15,"It's okay for the price, but there are better options available",5Q24NY2ER45,3,6b9d0f6d-1f61-4f09-8f21-49e692481c28
1a8b4c61-6674-4d27-8e5a-244436e665ef,2023-09-19,"The product caused allergic reactions, very disappointed",9AW0X47AK59,1,6bb065c1-5c08-4fff-b22b-ef103afa7bfe
d3b8df9c-aef4-447b-8be2-2877665c41a0,2023-09-06,"Perfect in every way, highly satisfied",2TF3VW5FK41,5,6c3ac051-9d6a-43e2-89d8-f98df4258976
8c8a1997-8ec5-45b5-b7b5-70cc70b80d0f,2023-06-12,No comment,5MN2A10FG43,5,6c4db882-1dd6-4e84-8101-e1077a840199
31b1c6b9-9148-48e6-a80b-071958c0b8b0,2023-09-17,No comment,8K30VM2YG53,4,6c584f4f-f44b-47cf-9cfe-75fae5758403
8f340e9a-e4fe-40f3-afdb-256cf4474178,2023-08-25,"It's acceptable quality, but there are better alternatives",5J29RW9EP00,3,6c585d5f-78fb-4c28-b0cd-d15b40bd1be3
5d2ed89f-5a7f-49d2-b2c1-ac2881bd6575,2024-01-21,No comment,7D70DM1NP58,4,6c85bf96-4d70-42e7-b5c2-07d8a5c27118
2be59d4f-1122-4c5d-a7ec-8f6b0e46b164,2023-07-23,The product is exactly as described and works perfectly,8NK1AD8FJ35,4,6ced9d3d-60c4-4877-ad99-560f1ed270d4
e3140d9a-fafa-4a21-a485-9caff3bb8d99,2023-12-09,"Flawless product, highly satisfied",2DA3XW4HY25,5,6d02f861-09a4-43bb-bb4f-2cf5edc6e7da
28379615-850d-4fb8-b151-0e6a8b40813d,2023-08-28,"Product broke after just a few uses, very disappointed",8T60Q83YJ71,1,6d177e2d-51a2-484d-a382-4426b1941397
f44ec57d-1c4a-4c3c-90c0-f450e437fc6d,2023-08-31,No comment,1K14TY2GE14,5,6d49a3df-dc8f-411b-8f3b-df5dd179e661
787a99d0-2ca5-4a5b-b64c-c13b2f39d8d5,2023-07-23,No comment,6CK7V69UP12,3,6d6fd9f4-6b5e-4c00-90fc-a3fc4ba6a474
5bb93fc0-3c9a-4363-b59b-0d1b296acf07,2023-10-14,"It's satisfactory, but there are some improvements needed",7DR2E19WJ69,3,6d976207-4d84-42a8-b62a-62971e7bee85
d0db8744-4d3a-4c3e-bb58-e1fa71e22d77,2023-05-08,The item was damaged during shipping due to poor packaging,2V49D19KW86,1,6da9a797-9c50-41e8-aae7-9592ea89e40c
780f636b-5616-4594-a5f5-fd3ae4631daa,2023-11-04,"The product's return policy was overly restrictive, couldn't return for a refund",6D73C39JV27,2,6db37062-08de-4384-a2f9-edebc63ce60e
3e2d5025-8830-4476-835d-408d0e74d2bc,2023-08-31,No comment,8CK2DT5UD73,4,6dd289a7-ec62-4a08-a8c8-ec24b0e938cf
1285a6d0-4d6c-4275-b9eb-bb06349c92bc,2023-12-24,"The product is okay overall, but there are some improvements needed",9J80C95GC78,3,6e1c4d37-ffe0-4543-9b03-7cc21a9be116
72698a2d-3043-447f-b276-5e22a5880df2,2024-01-17,"Exceptional product, highly recommend",6H44E65GN69,5,6e916d5d-6290-49fa-b4a5-56107b375394
44f3b3f3-0e2a-4272-9490-cc6278bbf412,2023-09-04,I'm satisfied with the quality and performance of the product,7WR0V16TK88,4,6edf8a6e-6736-4554-aaa8-37b271669f03
6317d8fa-2745-4dcd-b641-b2313751dc47,2024-02-15,It's a practical product that has made my life easier,6XD5GJ7AK48,4,6f1db5d2-a1d6-446d-a6a7-fc5675108534
6f4f355d-4201-4da1-88b5-82d6a7a249cf,2023-06-14,No comment,6K49P59MK21,5,6f41ce41-96f5-4abd-8d76-dfc6f7e0a14f
23d5f868-9cf3-4c12-98f8-db38aa4a51a4,2024-01-16,"The item broke during shipping, very poorly packaged",8V40U12UK39,1,6fb153fa-3818-4980-a47c-e4f293a86cef
db15dc39-bb80-474c-888b-254de253c910,2023-06-24,No comment,2KG2F91WR57,5,6fc26b69-78cd-4230-a2dc-6433b7444e1b
e4b015e7-b2b9-40e1-890d-2814718ad04a,2024-02-21,The product arrived damaged and poorly packaged,2CE0C12CN61,1,70187819-0410-48de-8a76-9031fe20086b
07cdff69-46c9-4c53-8ec9-77440ead10da,2023-11-11,"Remarkable product, 5 stars all the way",9T24WQ4AW08,5,702e53ac-54c8-49b4-9a5b-f5d9543eb34f
c84a7f0c-8fb6-483e-a66c-9fbd0397b624,2024-03-06,Colors were completely different from what was shown,3GJ7T34VY58,1,704d3657-406b-4ad3-85d3-1b61fe990b1c
d4e1acff-2ea5-4cad-aaf7-522378e44016,2023-07-17,"Cheap material, fell apart after one wash",2RQ9YD0TQ47,1,704f3a2e-e0d0-4c08-98ac-a48158502555
3fe28a13-69ca-4b05-adfe-2eda70b96c62,2023-08-13,No comment,8C90K10FC31,4,706620df-dbf5-4c9c-9bd8-88d737764a42
be3ccee1-1aeb-417a-91a7-769a9e1b16d7,2023-04-10,No comment,3MJ8Y97EK56,3,707d5d09-31d8-418b-a093-0e5a5e072382
765bd00c-d95f-4f5f-a4b4-df5bc9aabd63,2023-07-02,"The product's seams were poorly stitched, unraveling after minimal use",6EW8P82DX52,2,708292f7-33da-4aae-9bda-d9ebdab78501
aa780cbb-8674-490e-b497-72aeb259dee4,2023-03-19,"Truly exceptional, couldn't be more satisfied",3XF7EK2MT27,5,7095e625-6f2e-4a2f-a8fb-0d502e91390e
23e0b82f-8376-4ac0-b9f7-84eb732ef137,2024-02-22,No comment,8UX4R50XW13,5,70ee86f5-68b0-475d-9ec8-0fed0abab7be
a10f1845-54fa-4087-b00c-efbb177a65b1,2023-07-17,"Beyond satisfied with this product, 5 stars",4H40AP6KN52,5,7124e51d-049a-4120-99cd-258965f9bc5c
fc40cb70-e3b2-4931-8c42-fa4ac0576d76,2023-08-03,It's a solid product that does what it's supposed to,1E64EM2GH88,4,7151b477-834c-448b-b73b-f5899f6a3422
a8d49e2f-e121-418a-b29b-04e8a3277d34,2023-08-29,No comment,3YD6TE9HQ38,3,7193afd9-6d20-41c3-818e-d8a7c08bd31c
8d6b3447-0403-4189-91d2-b0eb4e97034b,2023-03-04,"Flawless product, couldn't be happier",5K13H42VN39,5,7226e876-549e-4207-a740-367389706d19
37251c10-6b5e-4b00-bce4-9fd950ae4210,2023-04-27,No comment,8H24M84WA59,3,728dd61a-4f58-46b0-a634-9ae7d4ff1c37
3862a8e2-9cbb-484b-841d-70942b542401,2023-08-03,It's a practical product that has made my life easier,8G87P25KF45,4,72954ec5-d371-4ff1-ac7c-da52ad1eac79
65d478ca-337c-4158-bd1b-c011bcd44a24,2023-09-22,It's a reliable product that I can count on,6UE1YE8CY27,4,72c4e818-8da3-4b90-ada8-6bf231f4ad4d
a9a15cca-54ed-4ca2-bf09-bc81d47ae8e9,2024-02-03,"I've recommended this product to friends and family, it's been great",3Y69XU2QU84,4,72ca6b30-55d0-4909-b3ec-7a224b60d22b
4157295c-341b-40e8-85b8-3dfca74e193c,2023-07-30,I'm satisfied with the quality and performance of the product,8AT0WD1CV64,4,72d07f74-c53f-463b-a38b-c9d6099e0059
cf60b1e0-8ed2-4809-a97b-05299fe4ed7c,2023-05-23,"Exceptional product, 5 stars all the way",2W94Q34PM68,5,72ee959a-871d-4e42-8664-873bbd9a95e0
f6e36241-6e0f-4e02-8a62-528102448637,2023-06-20,"Amazing value for money, 5 stars",1FC5FN3HK46,5,739e9aa0-fec8-4e25-ad52-4e95cf6cb94d
f886d8d4-66af-4780-b7f1-705886c4e205,2023-03-26,No comment,1EW2R65AA04,4,74248f26-84a8-42a2-a04e-b612580e7869
9cfb87a3-4280-49d1-9a0d-0aadd7078dec,2023-11-22,I've been using this product daily and it hasn't let me down,4NV2ND4QK96,4,74421dab-1f00-4191-bf59-72b16d2d5675
1a1760c5-b0a2-43e3-a90c-0f19dcbe30c4,2023-09-09,"Remarkable product, flawless in every aspect",9AX1CG4HY38,5,745fb573-a775-45e5-ac03-ace44b906e18
d1f8e92a-c30f-4e8e-b05f-120fa020886b,2023-10-24,The product was flimsy and didn't provide adequate protection,2UJ2AM7MQ80,2,7523101d-a020-4729-a593-133abfba6030
a2200c30-4b60-4574-8079-df2f91a7ce86,2023-06-30,No comment,4FU1UA1AR86,5,752a40a5-a3e2-468e-a498-034d17b26dfc
7d270dc2-a025-4b11-bf4c-3e3e540ff9b2,2023-04-01,The product looked used and not brand new,5Y55K16WV99,1,754bfff9-261d-4029-8343-ccef21fa40db
eae86a8e-0878-4152-ab7e-6a247917e154,2023-08-11,The product was missing key features advertised,1VY5X56HD78,2,765b7879-1378-4ac6-8334-db6ac5079872
f170966f-26c8-42c7-b76f-5f62289a725b,2023-07-22,"Flawless product, exceeded expectations",1M00RM1RQ03,5,765ec134-50e9-46dd-800b-d46669bd34f1
e54cbc4f-de67-43ee-9ef7-cddfbf3b06e7,2023-10-14,"It's alright, but there are definitely better options out there",1YJ4Y88CC37,3,774a7731-7145-4e52-aed9-b949b588199f
aca98e20-85c2-4be0-9840-cb71bcb5d1d8,2023-11-24,No comment,3VR6AP7DA89,4,777c56b8-009b-430d-b9e6-c122bdadca17
7c205d3e-f2a8-4709-865a-5a97a6497ccb,2023-08-18,The product was poorly packaged and arrived with broken pieces,5Y57Q10JK69,2,779cee94-a76a-4899-b1f3-8f52fe415329
29baae0c-38a1-4791-aeae-aadeb2144c5b,2023-06-16,"Thrilled with the quality, exceeded expectations",8RJ5MX7PA30,5,78757b27-fbc4-4b6c-b55a-ab9afa977e4b
547a5d81-a9a9-4103-a766-68ab2a010ec2,2023-12-10,No comment,7JA5P84ND56,4,78d322cf-4f26-470a-83ce-ff952861e387
d73841f3-5220-4d3d-aea9-60c75178efba,2023-10-18,"It's satisfactory, but I wouldn't rave about it",2QH2DW0HW49,3,79018152-8014-45a4-abcc-1dc7efdcc072
2d0d088d-357d-4f63-bc4e-8c0cd7b5aee7,2023-06-29,"Terrible experience with returns, had to jump through hoops",8MF3HR6NM68,1,7936fcbf-e133-4175-aa86-18e4acb76acc
ec1519ae-7ffa-4b85-9062-bb5dd413787d,2023-07-17,"It's a great value for the price, highly recommend",1VP3X75GX09,4,79740121-0872-42f2-97be-b632de89fc2c
4f431227-ce56-463e-a58b-7c04f6b8b435,2023-03-15,The product is exactly as described and works perfectly,7NC1GA1YT74,4,7995aea4-1e1e-478a-ba97-7e3fe1e375e8
6be1e3fb-4f21-4504-b831-85f432d8cc41,2024-01-13,"The product's customer reviews were suspiciously positive, clearly fake",6MT0UY8TQ82,2,79d18d75-3aaa-4ab5-b30a-e779d2505319
644aa9ce-2395-4ddf-b359-3027b0103765,2023-07-14,"Remarkable quality, highly satisfied",6W53XX0VH98,5,79d673e8-cbfe-4711-b675-9eb28c516c91
872eee73-8dcc-40c2-8926-2221b24aff10,2024-02-15,"Very happy with this purchase, it's been a great addition to my life",5U52EK3YU02,4,79edfc29-3c3c-4e43-9598-5aa3ee4e1c5f
625e8ca7-8fbe-40d8-9cfa-a1207e8ae70d,2023-05-25,"Thrilled with the quality, 5 stars all the way",6YF7QC5VE05,5,7a03e686-1df4-44c9-a446-6f665a5205f6
6f66c6a8-d183-42cc-903b-0a6427c86861,2023-08-23,No comment,6K49P59MK21,3,7ab83e90-e3f2-490e-9963-9a7cab53facc
cb1989e9-1818-43a4-ab27-4fc9d577303a,2023-08-14,"Exceeded all expectations, highly satisfied",3CJ9ND2WA32,5,7af0f4ff-b3f0-49d2-a836-98cc3d35efc6
8799177d-7811-47e9-bb18-f704e6ba409b,2023-11-17,The product had missing pieces and couldn't be assembled,5U52EK3YU02,2,7b1a1f9a-4f86-43bd-b98d-d915272cdace
95a12806-8071-436b-b3c0-ac8ca0e413d8,2024-02-19,No comment,5CU0YK2UU75,4,7b744b2c-f323-4389-bc45-87548bf503fd
59ded424-43f0-4fcb-8e6b-882e39b65625,2023-08-18,No comment,7FM1TY2WW43,5,7b7f5e4b-3deb-408c-83ce-ae9a24252a8d
3045a10f-aa45-41bb-8e10-0b0c3c2c0045,2023-11-24,"Flawless product, exceeded expectations",8KM5P47NP49,5,7b93be0b-618b-47da-9085-e95e5ed066ec
e87a3bf1-79da-4f8b-91b5-9b1a26e33621,2023-04-11,"The product had a strange chemical taste, couldn't use it as intended",1WT6JM1KW72,2,7bf02aee-9b9a-43c3-8196-abea315de366
fd717de8-33eb-4ada-8a4c-024d0572e90e,2024-01-07,"This product has been a game-changer for me, highly recommend",1DW6N60KX24,4,7c3e08de-f9e5-4691-abad-1af10a515a89
2d559d8c-3902-4aea-94ce-9652d510e437,2023-10-31,The item arrived with missing parts,8MF3HR6NM68,1,7c41caa5-18b3-470d-8f70-badf62e812c0
f6c618e4-e4fb-4793-8fd8-932b1641833e,2024-02-20,"Exceptional product, highly recommend",1FE1RT6KH53,5,7c63649f-8769-44bd-ade9-8581fa33f379
cbd85081-3e3b-4c5d-a3b2-3c187ea809ba,2024-02-06,"Phenomenal product, couldn't be happier",3AG7P53QD89,5,7ced5df6-da67-446a-b955-dc55c6dcaafd
7fbad636-e738-4d95-873b-c531fa2d15f2,2023-06-11,No comment,5XE2CF3NM24,5,7cfb751e-0eaf-46d0-96e5-1460697417ff
8128640c-ddaf-4335-8db9-e39054f7c25e,2023-09-07,I'm happy with the performance and reliability of the product,5X49PJ5JQ70,4,7d183e8f-5817-4803-a623-4030889d1495
c6b5ad04-1290-4741-b721-f47e1073ee13,2023-07-05,"It's good for the price, but don't expect top-notch quality",3GT7YH6AN91,3,7d1a3fc7-48d9-4e65-b20f-6bc9c7fe0ab0
1b5ca430-62b1-4be8-8d1c-056a43c1646a,2023-04-12,"Awful customer service, rude representatives",9A66H64FA64,1,7d5077be-0db8-4181-86e0-ce37ef02e65a
83877e92-0480-42fc-ae01-ee41a129a6ad,2023-08-02,"Outstanding quality, 5 stars all the way",5W89AE4RK75,5,7d6f13eb-63e0-439e-9b99-8362a81ad115
67118f0c-d985-48ca-9545-4bcedc15e951,2023-10-27,"Exceptional product, 5 stars all the way",6TW3HH8UW98,5,7d81584f-d030-4074-b06f-f5563b49bc5d
3dc0a585-e8f4-4500-b1e2-5536a7b5d71b,2023-09-18,The product is reliable and has performed consistently well,8CW6P39VR79,4,7dc78473-5ac1-4b35-b780-f86acf9564c2
99ac1c00-bece-4dab-b210-3a335ab1244d,2023-06-19,"Amazing quality, couldn't be happier",4QR7MM5ME25,5,7e1c33b6-9a60-40d5-9269-af258ec5aeb3
91947981-649b-4497-b6e0-f6de46994132,2023-06-27,"It's alright, but there are some minor flaws",5GW4Q24HM12,3,7e497a55-bd2f-484f-911b-cd9bb8efc4fd
7381de2b-873c-4d3e-974a-c86567e6cbd6,2023-05-30,No comment,6GH6RN6NU44,4,7ed71db1-3da9-4448-888f-b9e15c120441
136bd5d8-b05a-4adc-bb28-f47943d0a268,2023-05-29,"Phenomenal product, highly impressed",9GH4AV7XV99,5,7f47979c-ba36-42fa-ad4e-201e46e61183
f0c30555-1cc6-4ea2-89cd-08e556657343,2023-08-04,"Customer reviews were misleading, not accurate at all",1NW1NY0PP73,1,7f4b9174-0981-4ec8-a923-73524b29e744
60afeb77-de82-4c19-904d-880c212b6f16,2024-01-08,"It's decent, but I've seen better quality elsewhere",7C94KT1YQ97,3,7f77d246-ed24-4d14-9087-c439968c66e6
99673618-3ce3-4247-a185-9b4670ab38a6,2023-03-04,"It's a great value for the price, highly recommend",4U34CM9KF76,4,7fa86c07-6746-4370-b4ff-2076985b083c
5065d0c9-a260-4864-98f9-9444af7c37cf,2023-11-18,No comment,7MH7EK5AX15,4,7ffe87aa-0086-407c-81b2-8e220d7f19ad
76f41c66-2ea3-4416-8765-bda05cf022b6,2023-10-25,This product has definitely made my life easier,6EE8M41QM49,4,800c17a3-1114-46a9-bb29-774c985054e7
9c823e66-1879-4d1c-abac-4ee4e99ebd39,2023-11-11,No comment,4PE4FN8YX28,4,803f2ccc-e1b3-448d-9cab-374f938d5f77
6f80157a-e24a-4097-b56b-cbfbdda8a306,2023-06-25,Packaging was damaged upon arrival,6JV7M99CK28,1,805d58fd-fa84-47e2-a9f9-a65a7a8e95df
03b146d7-7bfd-4074-90a6-97f38dc711a4,2023-07-09,No comment,9WW1VF3FE02,2,8102cb07-9c21-4e4f-bdb6-e92d6207e2da
b7ad9494-c588-49f2-8de8-2ba5671587e1,2023-11-19,"Exceeded all expectations, highly impressed",3PD6PH5KN24,5,8125513e-502f-4065-b029-a09fe0d0f705
f58980de-118a-45d2-b02a-f8af7f9da84c,2024-02-13,No comment,1G44EJ8TJ08,4,812fd2c0-59bc-49c5-9405-da53c589f5a6
571be3c7-b559-4548-a404-b7460007261f,2024-01-04,No comment,7HR0PQ5VU71,5,81951583-d686-4ca5-a9a2-d8c10da882b4
0c6a2a0d-00ea-45ee-a242-bd9b1d3977bd,2023-11-07,"It's acceptable, but it's nothing to write home about",9NP3VW1HH90,3,8241e703-ea3f-40ee-af75-5b497984d358
74a9b9ed-d0f2-420f-82b0-c3b6c847a92a,2023-12-07,No comment,6FA1RE4WG80,3,82a785ae-76c6-4dd6-838f-3acf53ed1473
e068a946-917e-4482-8091-d1cf93de6510,2023-11-03,"Very satisfied with this product, it's been a great investment",2EK0Q11DW89,4,82d04a5b-3f99-4f42-be2e-f7d962bf51eb
ae63bfba-270e-41fa-b38b-0cc711d1dc7d,2023-07-11,"The quality of the product is top-notch, very impressed",3V73F74WY71,4,82fbc223-89bc-4993-a97f-3ce2ff45ce1d
25675692-5ef2-4526-a12b-4ca729ee1434,2023-12-23,"The product had a weird taste/smell, couldn't use it",8TN4MR0MG12,1,833a2643-909d-4e8c-8144-b687b1eebde3
e0e23250-445c-488b-bfc5-7650c3c212b2,2023-05-10,Very impressed with the customer service and support,2E90WN4YH34,4,83744549-b844-44d3-a594-e7df1cc94d03
7b8a75f5-3188-4a4a-988c-42bd7433a349,2024-01-23,It's a versatile product that has been very useful to me,5YW3PY7VC24,4,83ebec35-e9ba-41c6-90a1-287d6c3c13e3
2b8b15e5-e56c-433c-b98b-1b5269b33d93,2023-12-31,The product was advertised with false reviews/testimonials,8QF7N66QQ32,2,8427bf66-0e0a-47ba-bbf5-8932658de6f0
dc661cf2-0779-41e7-92ce-f51d9f54eb0a,2023-11-15,I've been using this product for a while now and it's held up well,2HE6WM1UJ12,4,84435fa6-e67a-44a7-81cc-9f12ce4a29f6
409e91c7-1570-4eee-b7d9-088ed2a890ff,2023-10-08,"Exceptional product, highly recommend",8C90K10FC31,5,844c7373-cafe-40eb-9045-be0a38a5f487
