review_id,review_date,reviews,product_id,ratings,order_id
4674e870-c78c-468b-afc6-a3aa3d526f77,2023-09-07,The product was falsely advertised with exaggerated claims,7W49NY4MP85,2,000611f6-cb64-47e9-93bd-22e4f8f12e4e
39f4f268-0eb0-454b-9a1a-419a41294cb5,2024-01-13,"The product was falsely advertised, didn't match the description",8F21FW6HR22,1,0008d32f-dd4b-4c6b-a76d-40ef28cfb2db
c66c5b06-5181-45dd-aae5-10a695c9f37a,2023-11-10,The product didn't come with all the necessary parts,3GV7G81TW32,1,004023f8-89c0-462d-8d0b-ebdaae4ac544
b271984c-af1f-4bb2-97ed-11dd34b6a3b7,2023-12-13,"It's adequate for basic needs, but lacks some features",3RF5N51PY30,3,004c93e0-dfc1-4190-bba7-2a018079b354
488292b4-280c-4cc6-903f-c150c2d13cc7,2023-07-31,No comment,7UQ4VG3DU35,4,0063c3f4-a9d2-44f4-a898-8a82cc7adb48
f2b9a720-6dc7-40af-948d-25d70aa6e85f,2023-06-04,"The product was difficult to assemble, instructions were unclear",1KU4PN8FU70,1,009e9fe3-9b63-4a48-b19e-ef4a2a686c45
8bb7d318-30e1-4bd9-b6fe-b1313b599d02,2023-09-16,"Amazing value for money, 5 stars all the way",5PV5D00DW17,5,00eb41d6-7f6d-4953-a3ee-c44fe375b0be
69be65d9-2679-40ae-8dbe-5e0b58875273,2023-03-12,"Amazing value for money, highly recommend",6NF6T09NQ34,5,00f15828-2fea-4fb3-813e-584f8955ceac
338d99b7-b004-43fa-9781-b31fbc679709,2023-08-14,"It's satisfactory, but there's room for improvement",8J59JK0QT54,3,01ae2a94-759d-42a5-ad8a-d44a7b52fbd7
195f5b7d-5825-4bff-ad94-858aa1e44ca7,2023-07-31,"Phenomenal product, highly impressed",9C71A69AA07,5,01e5df37-fc0f-4090-9763-8d11666c3bfe
ec06c1d2-9d6f-4b8b-9d3b-f01debb6f763,2023-11-25,"Remarkable product, 5 stars all the way",1VP3X75GX09,5,01eb445a-274a-40ed-9243-719529efeb21
09e93a8d-037e-4b01-9047-14444852d402,2023-05-21,The product's advertised range/reach was much shorter than stated,9PH6HJ5YF42,2,020b84c1-e10d-4d36-8a5f-07901e40a66a
782e9391-bc95-4f8e-a4e6-0da25cab071e,2023-11-30,No comment,6D73C39JV27,4,0268f6b3-9931-4e20-94cd-37e2f163046f
a88fb104-c4c8-4d8b-b11e-3b074a555013,2023-10-08,"The product's price dropped significantly shortly after purchase, felt cheated",3YD6TE9HQ38,2,02f693bf-e952-412a-a687-24c5bc8876be
88c81216-a0dc-47f8-bc69-838b752de473,2023-12-27,No comment,5TJ3EK4JJ51,5,032271c1-384f-493e-bf2d-2f5da21a72fa
02e831db-877c-4698-9ee3-30d989d26abf,2023-06-30,"Impressed beyond words, remarkable product",9Y46P59HU11,5,033d73e8-5008-49ae-b9f9-1e27542d681d
2645a7a6-91ed-466f-9517-0ddf6f4517c7,2024-01-11,The product was flimsy and fell apart easily,8TH8GX4QA76,1,03718afe-c1bb-4b2b-a4cc-837087a6bf6d
00718697-bfa9-4680-91c1-4ded249f636e,2023-08-14,The product was advertised as waterproof but couldn't withstand a light rain,9YW3WM0YQ23,2,037b0c7e-2ef2-430f-adf7-45da6ca0293f
efefe5d0-7b0b-422c-9f47-c10961c97cbb,2023-09-23,"Outstanding product, highly recommend",1QV1FJ6KQ49,5,03a94f50-4a27-4ae7-8953-41fea5b04a57
bd0331b6-8e37-467d-af3d-8867778156dc,2023-07-04,I'm pleasantly surprised by the quality of the product,3MN8HA6RG92,4,03f2c521-f477-4212-9075-842321cd4269
96b581a8-bd63-43a7-94ef-3f257233188d,2024-02-16,No comment,4XF8TG5CD85,4,03fe6505-7afa-4111-a2e0-10a18aa3cee9
35c970cc-745b-4bad-a79c-2916a3e7e6a9,2023-03-15,No comment,8H99HV5HU19,3,044d5dba-3967-4dd5-8f7f-0fb67f5518a2
69010e57-78e6-4438-81f4-ac287d5d45c5,2023-10-11,"Very happy with this purchase, it's been a great addition to my life",6QM7E33MW15,4,048173f8-8ba1-4f11-ad82-4a887a4677fb
cb69ac8f-c406-40a9-b2ed-f2f893332686,2024-02-07,The product's customer service was unhelpful and dismissive of concerns,3AG7P53QD89,2,0498f3e9-0607-4934-96b1-7f872ee11ecb
ce37d8a7-2780-4a62-9825-e43561b81bd1,2023-06-20,"Exceeded all expectations, 5 stars",2X14GE5JE78,5,04ba7863-1a42-445f-b929-cea693edd6a6
e7c553cb-829c-49c7-8bfb-360dd781de7c,2023-10-02,The product's advertised speed/performance was significantly slower than expected,1WU2X43WQ02,2,04eb5592-7525-42d9-a316-a494b4c8b997
fe951c97-8d1d-4f35-bab2-eea7029d3538,2023-07-01,"Delighted with this purchase, perfect product",1DA6RG8RP66,5,04fb44c4-9197-4e8a-a72a-0161da4e0b49
5869ac62-f6aa-4bf2-9b21-d86274201327,2023-07-20,"Impressed beyond words, perfect product",7H97W05EC17,5,05063da1-5a7f-48b5-8f15-456c98341753
e2541a97-f70c-4207-993d-e3ed98ef5ea4,2023-03-27,"It's decent quality, but there are better options available",2DR2EG5UW48,3,05378fbc-74b5-4259-b18d-1f6bbf99d919
8a7ecdf0-23fc-450d-a6e0-088c17fe2599,2023-07-17,"Excellent product, would definitely buy again",5RD6F26UD90,4,055fdfe0-dc75-4765-a3e8-bba43c30d135
d9eb2385-e456-478c-b296-452d5587eb67,2023-12-27,No comment,2N28RR7CJ20,4,057d975b-55dd-4ef5-a8f8-4a42bdda5bf9
7aad52f6-d37f-41e1-8e4c-88d829e10007,2023-07-15,No comment,6AQ0QD0VQ97,5,05852ff8-b289-4d83-b882-8c995c24ac1b
f9db2704-d95c-4910-9fe8-75a922daf163,2023-07-08,I'm satisfied with the quality and performance of the product,1EK3HG2VD35,4,05b77487-3f31-4d92-b459-6453926a442f
4f4263ac-230a-4ce8-b5f3-01257280e46f,2023-03-29,The product was poorly packaged and arrived in a damaged box,7NV0MM2GU87,2,05ce6c75-4a20-45d9-9497-83392c0b5458
3ea6ef2a-8479-4325-8cb1-e0580db56930,2024-02-19,"This product has exceeded my expectations, very satisfied",8CJ0WK8RD77,4,0634694e-ef27-45c9-abe6-ca44e1eec41f
907c5bfd-0e55-4348-9a69-4918df09a8d9,2023-06-14,No comment,5HH2QP4DH58,4,06397d42-8f44-47ae-9414-c1ec827def1f
a4962bd5-3116-4f1e-b09c-21387e9888b5,2023-08-17,I'm happy with the purchase and would buy again,4E80AQ2RY02,4,06828466-5303-4513-bf7f-1ada5cc75af2
72cd9a3e-fdbd-4b77-9786-984794f50b43,2023-08-04,"It's alright, but I wouldn't call it exceptional",6GX5N08EG75,3,068a6d3a-4e54-49fb-94f1-6bf2d0b46e69
5f2867ad-c220-4565-bdbb-fc177403598d,2023-03-03,"Phenomenal product, highly recommend",7D09QR6MQ04,5,069bbc33-7cb7-429e-a37e-a0ad1b58920f
b483e42c-4d8d-411e-95e1-f6efc60e8a8d,2023-08-28,"Poorly designed, doesn't function as expected",3R21F88QW42,1,06adc403-a101-4543-8a2e-238db94d961e
a6f25dc0-9407-49a0-b21e-14d6815877ff,2023-10-02,"Exceeded all expectations, 5 stars",4CD1EY4RX88,5,0716171c-fe6f-4045-8eaa-593eada725d7
de8483b3-2089-4839-89fc-3bc2b602537e,2023-12-22,No comment,2GR7CV3QV32,3,0760e0ad-06d5-4fc9-b51c-28d315e4e10a
8d5bd959-959f-4ed8-a4c6-6f62d6fd1b30,2023-07-22,Item arrived late for a special occasion,5MA9NC4VR07,1,07b095b4-054d-47ea-b7a8-6f83550031b1
fc433f3a-4799-41ee-b886-dc484fb1b6d1,2023-09-11,"Very happy with this purchase, it's been a great addition to my life",1E18CV8KY44,4,07de224d-997a-43d3-8c69-1ea17d220b95
2648cc33-d67e-47a8-b348-120838c413cb,2023-10-16,"Absolutely fantastic, 5 stars all the way",8T91R76RF07,5,080d77d1-412d-43d8-8353-ba1aabc4611b
7ec4943e-6351-42c0-af00-38c9af9123d6,2023-10-11,The product was falsely advertised with incorrect specifications,5Y48F97CT45,2,084179ae-4f5a-4628-8ed4-ca21580412d4
0e1d8af2-5465-41ed-bf9a-2970cd54437b,2023-04-19,I'm impressed with how well this product works,9N04AM5DF62,4,08422656-2679-4e75-acd3-8d01343e9699
9b887758-9472-4aa8-b914-b2cd08a0e47b,2023-03-10,Very impressed with the customer service and support,4PY5J31XT77,4,08e04e08-d3aa-41d7-ab4d-83081082489c
cbfcb263-44a0-42b4-9e9e-837dbb3c0b9c,2023-05-20,"It's decent quality, but there are some minor flaws",2Y60NQ8TQ62,3,08e5c28d-9d95-4107-b622-83fc82f36c50
f395cd8d-d8ac-4bc8-ac43-ebdc1ec49ca1,2023-03-22,No comment,1K86J51FP88,4,08f6979f-de60-4e69-849e-7027ce25b701
22d7b340-f0c8-4e77-882c-bcea2468f206,2023-11-29,I'm impressed with how well this product works,8WC2D42XG58,4,08fe55f3-59ae-4422-9521-e6ca21545883
59dad886-dc1b-484d-898f-4d168e6e6fd4,2023-07-14,No comment,7FW5E80FG12,4,092f1da5-82df-4b3b-803a-ef9417f13453
bfe7b80b-94c1-44da-95e7-0a93f565a7c0,2023-09-08,It's a practical product that has made my life easier,3KX9J46CK33,4,093cac12-5e59-474a-964d-2bb2b9e08c6e
53c8bd90-7ac1-4b9a-95f1-c76c170f91fb,2024-01-15,"It's good enough for the price, but not amazing",7JM1DQ6PQ60,3,0a0bcf58-a8b8-4460-81aa-509e1883baa5
f92ad677-f932-44a1-b710-9e2442f3fdbf,2023-11-13,"Outstanding product, highly recommend",1EM0JG5FQ43,5,0a201af6-56d0-46d1-b5ba-f34b147d273f
706cd5ca-bc7a-4e99-9bc4-e02498bd6bb8,2023-06-27,No comment,6JF7KC0ME02,4,0aa7b3ef-b4c8-4045-a225-7e3e0bf2029b
423d084d-958f-4da5-91c8-2300dfa25480,2024-02-11,"The quality of the product is top-notch, very impressed",7Y92KU2TP05,4,0b1d6d9c-bcff-4ba8-b46e-1cf9c0bc0ab9
9c98ac5e-464d-4fcd-bd33-5a4eb613c488,2023-11-16,No comment,4P04DE2TU61,5,0b21b4e1-46bc-41e2-8e06-63328517fffc
0b478523-724d-44bf-a3ed-1ac9bc04d88f,2024-03-01,"Impressed beyond words, outstanding quality",9NY9U19DU27,5,0b3b806e-755e-407f-9904-819fd1139ea1
6283dbc3-d8cf-471a-8048-10936c25c276,2023-07-25,"Amazing value for money, flawless product",6YD5PR4MN09,5,0b4a539c-bfcb-4c7a-9483-68032465c3b1
8bfe6797-6109-4fbf-9d3d-ed64f82d3c8c,2023-05-31,The product's advertised health benefits were unproven and unsubstantiated,5NY9RN5MP43,2,0b621a7c-8b40-42ee-a7ff-460dfbaa8624
95e14d61-7051-4b58-a561-c2a93c8e2ca2,2024-01-09,"The product description was inaccurate, misleading",5CP9DJ1MD50,1,0b8f53d5-6909-481e-8045-c43e8adcd4eb
f0060d9b-b1ec-4885-84e1-aff208cdd49e,2023-03-20,No comment,1QV1FJ6KQ49,5,0b9fcb70-3357-4039-9794-1b4bd557f2e1
d94da21d-42ff-4dce-917e-c50acfbc14f1,2023-08-03,"Impressed beyond words, remarkable product",2N71F96TV82,5,0bcf8941-de5b-4b2e-8594-73101f72e5a9
73d6275d-1201-42e4-9ca2-6c2815e84e6d,2024-02-26,No comment,6FX8TX9JD34,3,0c2435e5-8c98-4e31-8ac8-b4e8736b5313
1f449180-908d-40b7-a75a-18af09c8e979,2023-06-19,"Very happy with the purchase, it's been a great addition to my routine",8Y18HN2FX67,4,0c4bef1e-11f0-44cb-93bb-6d236438dc9c
caf782a5-b455-45d0-a109-63fecfbe6cf8,2023-04-10,"Flawless product, highly satisfied",3CJ9ND2WA32,5,0c683674-dd4b-4f93-b20a-1e420639a96c
535130e9-cce3-4881-9b8e-9331b408add4,2024-02-17,"Beyond impressed with this product, 5 stars",7KK4QD6VJ27,5,0c8c167f-5956-4a77-a7f9-0406c5218f48
0328be45-5622-4cd3-9cdb-fe800c6b3dc2,2024-01-18,"Perfect in every way, highly recommend",9X84U33GJ83,5,0cb125b7-839c-4a34-ba8b-84043cf200ce
3c421eb8-7c02-4b8b-b1c9-627cecea3372,2024-02-27,"Fantastic product, exceeded expectations",8DN2TX0MM40,5,0d02b7f9-4603-44c7-805c-9e6d243be3ea
e3fc9a9e-a0bf-4cd1-b9ec-f42c7989948b,2023-05-05,No comment,2CQ8KU6VJ74,5,0d368843-6b08-4f86-930c-2933a84c0abd
6b53ed53-3212-4e36-b94c-3066b1e03c0d,2023-05-19,"Couldn't be happier with this purchase, 5 stars",6N29QJ2JV21,5,0da804bb-2619-426c-8164-a2989ca91594
4b6e700a-81ab-4aca-b271-0feb3a2aeaef,2023-09-09,"Exceeded all expectations, highly satisfied",7TW0V34AQ54,5,0dbffc92-c5b3-4302-9cdd-9867306e087d
0419979d-9397-4028-a223-382f6de1a561,2023-12-04,"It's acceptable, but it didn't exceed my expectations",9W52M81YM44,3,0dde4c19-fb4f-4f4f-b3c3-42c5151d6180
6b2a4a60-7ff3-444e-ab03-8d464a7c0f26,2023-04-08,"This product has made my life so much easier, I'm grateful for it",6N52XT3EH05,4,0e03a2bb-dc9d-4fe3-9511-5b8bc5e7b03c
e471e206-c943-42df-9a82-96a5487011e3,2023-11-04,The product had a strange chemical odor,2CK5AX9KH72,1,0e11c057-8f78-4ea9-91bd-76536f8a58f3
03ecb222-896b-4466-988a-4a9ccbbfe1e1,2023-05-30,The product's advertised versatility was severely limited in practice,9W78TC5EQ21,2,0e2be5eb-a420-49e4-9fb3-13584e822918
940c77d7-dc3a-45a1-a4e7-0d15afa884e2,2023-10-19,No comment,5D75GP1QA97,3,0e828138-0a2b-4cd9-9bf7-773bfa265d47
a4c4e6f4-d661-419e-acd6-67a89eea8a5d,2023-09-20,No comment,4DX8P08KE60,2,0f39f308-7297-4976-8dfa-01ff1b53a703
3ddee0ef-0855-4381-abc9-b1f4e8ae67f3,2023-10-02,No comment,8CW6P39VR79,4,0f7fc924-07ac-4815-ba4b-84cf767687b3
88b1d1e0-8e3d-436a-b5cc-bfaef389bc2d,2023-10-13,"It's decent overall, but there are a few things I'm not crazy about",5U01FW4VA70,3,0f99b31c-9aab-4158-9d4b-75fee2406010
6b373e5c-470a-43f3-896d-a997fd67c283,2023-09-08,"Impressed beyond words, outstanding quality",6N40G90TU39,5,0fd247a5-cc17-4e6e-9ce4-f6f33c3ea15b
e8c95553-690c-4dfd-9461-c0dd7cb2782d,2023-05-14,No comment,1WM1JK8UM13,4,1050a94c-315c-4047-8c67-e3aab5571464
032cc356-fc9b-40b6-96a4-acc82c89278e,2023-04-22,No comment,9X51WH6DA98,4,1096d4c9-d69f-4e94-a48a-2857f35a3517
e46b2996-80d2-4148-ab3d-4bb0871de3d0,2024-02-17,I'm impressed with how well this product has held up over time,2CK5AX9KH72,4,10d82171-385c-4b69-b82d-935179e70447
9f88c91d-24a8-47d9-8693-16ea7d61920a,2023-10-22,Very impressed with the customer service and support,4K02WH5RU84,4,1105602b-dd43-43eb-8f3b-932aaf84497b
72e94006-04d3-4441-83a8-15432c128681,2023-09-10,I'm happy with the performance and reliability of the product,6GN1GW1FX19,4,113d8efd-2de4-4146-96f0-8b745a01c523
f2dc01c6-5141-4aae-a642-5781d0e1b7f8,2023-06-11,It's a solid product that does what it's supposed to,1KU4PN8FU70,4,1152331a-792a-445b-9238-98059bff5e83
959aef91-1905-40e1-a148-95283e9b4768,2023-07-08,The product's advertised noise level was much louder than anticipated,5CW2Q80YT56,2,117797c6-4047-4f5e-afdc-66a36238fb3c
47193e34-1e55-40e5-9e1e-1558233ea76f,2023-05-13,The product arrived quickly and was exactly as described,7V67UG4AX61,4,120148b7-3269-4434-8b27-e3cee5486f13
2429d2b8-0025-46b3-af60-88cb8e4d48d9,2023-11-07,The product arrived dirty and stained,8UD1QJ9NF11,1,1202ece5-636d-4cf5-868b-07495ff5b516
0b9807cd-25d2-407c-aeb6-c90e694d2d63,2023-05-11,The product was flimsy and didn't provide the expected support,9NT8MY7YJ09,2,123109de-7007-48b0-ad71-714d10f328f5
3d7d0e22-7f52-4b63-8cc2-e525a759b1af,2023-05-17,"Perfect in every way, couldn't be happier",8D39MP4NV93,5,12411945-5d90-4f5e-9ea2-a3bac4e21f3c
ab67fcd0-f6f7-4854-94ab-a67098accac0,2023-08-04,"The product had a strange taste/texture, couldn't consume it",3W43X93XD24,2,1258ba01-491c-41c9-ad6f-8985bcfb80e6
a49eb6c4-5217-4505-80fd-cf57892a9015,2023-07-25,No comment,4E61UC9GJ54,3,125c0272-9612-4116-a01d-b0bfafd48fd3
32e1cf36-de8d-4ced-8e38-50cba4032315,2023-04-28,"Delighted with this purchase, perfect product",8J89FN7UP81,5,12939a20-358c-44ec-becb-ad7f910fb863
4d955f3a-10c0-4df4-9773-c5c658a170ba,2023-10-25,"Delighted with this purchase, 5 stars",7RG3QU4CJ09,5,131e890e-8f2b-45e3-8b32-262d470251d2
264f6dae-16d6-437c-947c-0767d5803c9c,2023-04-21,I'm impressed with the durability and performance of the product,8T91R76RF07,4,13749707-f618-48e9-8628-d36f41d5a9c5
f247b75a-afb1-4642-acb3-d1fc78a17b5b,2023-03-19,"Excellent product, would definitely buy again",1KX3HJ0KH41,4,140e1fe3-5c53-41c9-8043-e1401d696650
9d4cc7c6-ae1e-4710-a3db-c40a6c0d9642,2023-04-09,No comment,4ND6W41QW92,4,14147ca5-2407-482f-b63e-be6e4ab5a565
64b01d3c-e779-46f9-8d46-5646417677a3,2023-08-05,The product is reliable and has performed consistently well,6W13GD4YT62,4,143193a7-14ed-47e9-85c3-5d32fa0a4cde
12fd36f0-5458-4e67-9deb-80edadc233d2,2023-03-31,"Amazing product, highly impressed",9J80C95GC78,5,14393f03-5008-4c2b-9e36-475c488c4a69
ae4cc408-62cc-458f-ad9f-2cac275b9b55,2023-03-16,"Top-notch product, worth every penny",3V73F74WY71,5,144d4ded-5ccc-4116-a354-9d1f9db8d1e9
db7d94aa-23fd-4caf-b540-44efef3f4380,2023-05-03,No comment,2K90F96PU95,5,14509b97-6017-4b37-baee-d302098569a7
f479f427-09dc-4018-9210-494bfbb6d12d,2024-02-22,"Thrilled with the quality, highly satisfied",1JC7FK2FH11,5,1504131b-47f5-48c5-9425-16a37a0bc875
a4785e6b-a20a-4c28-b39b-2bb47115e2ce,2023-06-10,"Impressed beyond words, outstanding quality",4EJ5GV7UX97,5,154196fb-f9fa-4d6a-b9e1-09ebbfc2cfc6
ee208497-deca-44fa-8d03-7bf32797d1f7,2023-10-22,"I've recommended this product to friends and family, it's been great",1UG1YP3NW05,4,15d3d45f-66d6-4649-8b59-dc3515407e43
cc19232f-3e43-4232-b79f-96b97b713b62,2023-05-22,"Perfect in every way, highly recommend",2Y60F83UJ37,5,15d8d377-a71f-4ec7-bf4b-2c84374cb5e1
14b37e01-1743-4f00-ade3-e3d65d763bbe,2023-10-22,The product is well-made and feels sturdy,9EW8G06MH98,4,15e7d5cc-049c-436f-b40b-1e69c7b60b65
98abb442-f6e3-4fe9-b348-af9ccb4f06ed,2023-05-13,No comment,4VA3KE8TK23,4,16145ec9-9895-4681-b6d3-386d7bad5a90
8d5be61c-0b45-49b1-987e-3cf5fe6bf08a,2023-05-21,It's a versatile product that has been very useful to me,5K37U95WP77,4,1618d4f8-624b-4221-9cf8-db021d89fefe
1abf7ffd-61d3-4f50-af0d-aca22fb4e55d,2023-03-01,"Impressed beyond words, remarkable product",9AQ7AM9TQ26,5,171ecc71-5e3a-48ac-b346-c32a1f30d7ba
64fd3726-0519-4123-9adb-4345ca22dce3,2023-10-18,No comment,6VY4KV7WN57,5,175076d9-9fa8-4ccc-a5de-1f9b733ef97c
90678978-48cc-49b5-9483-99f2a6f0d731,2023-05-15,"It's a great product for the price, no complaints",5HU4HW2JM72,4,176cd5c6-f445-44f8-9545-a95f42e2ea3e
a089adde-6438-4e72-b27d-c1465ac75d83,2023-11-16,No comment,4HN8KJ4AN20,4,185835af-1551-4bdc-a759-588874cd197a
db72f944-cfca-48eb-9452-781ac962fccb,2024-02-26,"Perfect in every way, couldn't be happier",2KG2F91WR57,5,18b09293-ccff-43ea-96f8-2803ea579f86
313484d4-2c9a-4b84-bc8e-2bec3a0843af,2024-03-03,"Exceeded all expectations, 5 stars",8KC0MY4AH53,5,19179efe-26fd-497a-9d67-6524c302fb8c
43b2c6a1-8388-4da2-9b94-35687a2f763a,2023-09-15,"It's okay, but I expected a bit more for the price",7XR1KY0NP64,3,194d8ebc-cee0-4a2a-b92b-f6643afe33b6
cf4d65db-7226-4863-b402-bda60bf1e7a1,2023-10-05,"The product's durability was vastly overstated, didn't last long at all",2W97XV5CK75,2,195e4a83-2949-4f42-ba5a-483ff84efadc
b6093c37-587d-44a5-8973-bb806cbd3caa,2023-09-25,The product is reliable and has performed consistently well,3PX2RJ1RY98,4,195f36b7-dc05-418c-989e-727bb5339329
150c4ece-03d5-40b7-bf13-744548691074,2024-03-01,No comment,9ER6Q43MT36,5,19f6b889-d1b4-4c0a-8b25-ea82c0c6d274
fef53abc-3190-492d-ad66-217567c9c6da,2023-06-13,No comment,1D22FP6FQ23,4,1a0eb4a4-c7ca-4e65-8faa-2202584f1bf0
19a5c3a0-22b0-4d5e-8c24-1098d3b16153,2023-07-19,"Impressed beyond words, outstanding quality",9C14F39JK70,5,1ae44764-f6e6-4755-b094-531442b5c7a9
fc266d8b-2f86-436a-ba7b-22e8b8be9b66,2023-07-03,The product didn't match the size/color options chosen,1E64EM2GH88,2,1b012f4c-72a2-46f9-8748-87506a78bd6b
f5c981ef-00ba-475e-9636-545d3c38f644,2023-08-05,No comment,1FV3NC3ND01,2,1b0980e7-f662-4bb1-a46c-de25dc7123cc
9ef46539-42b7-4601-a9a1-2cb888497ae7,2023-06-13,I'm impressed with the durability and performance of the product,4MF3GY4HF03,4,1b75abcb-b85f-421e-8ac3-1c33324abc98
09362055-111c-4096-8f4e-bc96108677dd,2024-01-14,"Delighted with this purchase, 5 stars",9Q38HC4YY51,5,1ba3f77b-4700-4c55-992f-f0c6551f755a
2562d4b8-243d-4ade-86a7-ac124d05dd25,2023-05-11,"Delighted with this purchase, perfect product",8TQ7P39MT97,5,1be56f0a-5b31-48b8-bb65-6fc72f126adc
c44b8865-cdf8-4c18-be01-a978f0babd30,2023-07-14,No comment,3HW3RY4UY11,4,1c52bcbb-90b7-4f45-a063-396d95d0bdaa
0311e278-c3d0-4c6c-b01e-1eb6ee49e237,2023-05-28,"It's a passable product, does the job but nothing more",9XG8PA0MD85,3,1c8ddc25-c59f-4821-bcbf-616616f44c65
2c2d6182-b7cc-4cc3-91d8-280217abeeb8,2024-03-02,No comment,8NE7U26UQ11,5,1ca3c6ab-553d-47c9-bd1a-a4983f54f207
2239cde0-83b1-4094-80ac-a2ecaf13717b,2024-01-18,Overpriced for the quality received,8WX9T98EC83,1,1d025796-7ca8-4b90-8437-dbe483a1eb5e
59dbb937-9187-412e-94ad-22a528e71953,2023-09-05,"Amazing value for money, flawless product",7FM1TY2WW43,5,1d160eeb-686e-4de5-9cf8-b78c0032552e
b4e79022-c2c5-49ce-beee-0d08c66e6bc8,2023-11-30,I'm impressed with how well this product works for the price,3R21F88QW42,4,1d1d3cc4-296f-43b1-b6b1-1e497993316c
02411c1d-ab77-4e23-931c-baf94c0d1c80,2023-06-17,"Overall, I'm very pleased with this product",9YQ9VH3WG32,4,1d64fed6-1bb7-4555-b532-2bf8d8157222
0ab83352-9389-40c5-b87a-240089c84ea4,2023-12-01,The item was poorly made and fell apart quickly,9P79Y02NY30,1,1daff4fd-f984-4f29-8ba8-a3fd52917aad
d47d3b11-c776-41c3-8b3f-c59280d63333,2023-12-15,"It's alright, but there are some aspects that could be improved",2RX1U41JG45,3,1dccb836-f17a-472f-8a20-c0418cc9d995
ebe416a0-563d-4b1e-a03d-089d33981b5c,2023-03-08,"Impressed beyond words, highly recommend",1VR9RD2WF74,5,1e0c7d1c-b835-4023-be84-280f47d0421e
2ba6c2b3-8de7-4d66-98b0-d7e6c1c0f9b1,2023-11-13,No comment,8Q22KX7UU10,3,1e223db5-b8ae-4e9c-890b-f566463ae4c7
8948a474-b9de-40aa-a801-5e159e954d45,2023-03-25,"Amazing product, highly impressed",5TD5FY6VD00,5,1e444cbc-dbbb-49e8-af3b-4fe2ddc42678
70ad0dff-9243-4b34-94f1-04e0ae40162f,2024-02-05,I'm impressed with how well this product has held up over time,6JA8KA1DH33,4,1e74a4b1-4268-4c98-82ae-f82d74dc94aa
438a7baa-dd79-4086-8cb4-4e6339130eec,2024-01-14,I'm impressed with how well this product works for the price,7XR1KY0NP64,4,1ede96d3-48ad-479a-845f-d2ad68fa02e4
98e0b55f-147b-4ca3-a306-0c4c9bae9456,2023-09-17,"Delighted with this purchase, perfect product",4U34CM9KF76,5,1ee7a5a4-6d36-4bb3-a591-15147c74b26a
b0c8df86-4831-4eb9-b4e7-6dbfe9616afe,2023-09-02,"Exceeded all expectations, 5 stars",3UP4W84HA40,5,1f148f02-e1f8-4b5e-a07f-40e22ace03e8
442b6ded-2f39-44cd-a06d-3bf8e53beea7,2023-07-23,The product is well-made and feels durable,7WY7AR5WT83,4,1f1849b2-8987-4c52-8913-2d121c2873d0
8cf55d10-f5f0-44c8-8c34-3611a24212b8,2023-06-15,No comment,5MA9NC4VR07,4,1f95bfd1-c9e2-4699-b1f9-3a860ca1f607
a0770bca-1f74-4f9d-8383-ddb8c75eba35,2023-04-29,"Perfect in every way, exceeded expectations",4HU9VD5AQ78,5,201d89fd-cc17-4711-a6c8-c95bf9fc35dc
51a04a79-7672-4668-8cbc-dcea6c2f72ce,2024-02-14,No comment,7KN6VV9CC93,5,202ea378-d29b-49a7-ba21-e0a215ae486c
d9fbe598-44e8-4809-a1b8-3f5e4b14978c,2023-07-30,No comment,2N28RR7CJ20,4,2048f876-5b81-411d-a3c6-6c9d2b6e62a2
95a96904-3763-4b4e-87ba-6fece6d7d3ff,2024-02-10,No comment,5CQ1KE2YU33,5,20630a75-9550-423b-8437-fd62f77e7c9b
44757e61-17c4-4bb0-956a-d5b2ed3212d1,2023-12-31,"Couldn't be happier with this purchase, 5 stars",7WY7AR5WT83,5,20d71261-c7bf-4899-9716-c89f976d0216
2421c4bf-cc73-45bb-b6bf-2733d12603a6,2023-08-27,The product's price was inflated for the quality received,8UQ3TQ0QF98,2,212ddc32-7e0e-45d8-b555-f3f42557d8b5
33a53c5c-8ff9-4946-bac4-e0d7b4561fc2,2023-12-25,The product is exactly as described and works perfectly,8J42UQ1UW92,4,2167b907-1e67-4c9a-94b8-fd274a83ff12
5399ac90-93a9-40e5-9301-0d57dac284fe,2023-04-07,No comment,7KK4QD6VJ27,4,21f718ea-f79c-429b-8838-6464fd389ff1
566a01b5-918a-4b70-a74f-af2ef26f6aa2,2023-04-27,"Very satisfied with this product, it's been a great investment",7J20TT6QQ76,4,224e2ae9-004a-4b23-9456-e6e00a186231
4f5f806a-42f3-4dec-ac45-ae1584ba4c1c,2023-08-18,"Delighted with this purchase, 5 stars",7N88VQ4UE55,5,22524a30-bbef-450b-9083-ba1ac147d3cf
c9e9f612-788b-4f5d-97cb-183af5cb84d1,2023-09-08,"Delighted with this purchase, perfect product",3EC9EY7UV30,5,2252f760-04de-43e3-8bf6-0c13ea65a4e2
0b2d91a0-ec94-47e7-9fd4-43e60e123603,2024-02-09,"Amazing quality, couldn't be happier",9P79Y02NY30,5,22560953-2c68-4934-89a3-db81fd2fbb1d
866ac07b-6d3a-446a-8e07-d0860060edb0,2023-11-29,No comment,5UP1X15CX00,4,226f414e-61e4-4df0-9c12-4af17facf6b0
bc2b2d66-0cdf-4da0-83c2-102e44194d91,2023-11-14,No comment,3N02HW9JT20,5,22739ddd-712d-4e28-b545-963ba522f0b2
90ee8772-b3c2-42f5-bf51-c5325b820f81,2023-06-16,"Couldn't be happier with this purchase, 5 stars",5HC2NX5MK84,5,2279eef3-050e-4e30-94b1-07ff79c54205
cd24b26c-1ac5-4711-8f9c-bad9fd2cad34,2023-06-02,"Flawless product, exceeded expectations",2XG3GF7YT79,5,22a8fe35-2deb-434a-97a8-302446ae94ce
fd971763-c539-4fbb-bdf6-b1160493df8e,2023-11-18,"Perfect, exactly what I needed",1DC6MQ6EE31,5,22b0cd09-e117-4b90-8925-bc02c6c496fa
d2bbc113-ce4e-4e66-ab40-3e3dad04b99d,2023-04-30,No comment,2TJ2A38WG37,4,22eb0bdf-b770-4d4f-806a-54f681eee14f
74b36509-fa4e-46ef-af13-39e69fcd8ec0,2023-11-26,"Five stars, no complaints whatsoever",6FA1RE4WG80,5,22f4d1e5-8a3a-432d-b824-ed63aa38f7dd
712e66be-6cb3-4cbf-b79c-a49039f447b4,2024-01-03,"It's passable, but I expected more for the price",6JA8KA1DH33,3,232447a0-7acd-48c8-be19-2260832a3d2d
5a98b9cd-c614-4dc1-8461-9dc9e10bfdf8,2024-02-22,"It's acceptable, but it didn't exceed my expectations",7EF6FU7VJ35,3,23a8fe63-6486-4759-9179-d80a3d709c77
c083c8bf-08c2-4b2d-a8b3-39d06ed2673f,2024-02-20,No comment,3KK7C45QD90,5,23accd6a-9c09-4951-a19d-7cfcd5dda7a5
2ca20aad-bda9-44e6-b0d8-8f767cf13233,2023-04-16,No comment,8N99CC0TJ53,4,23b87ff6-00d9-4af9-a6c3-c87e93eb7663
42051958-900a-4769-b625-86655fe8afca,2023-07-15,No comment,8A73R04AM17,5,244463b8-c29c-4184-95cd-c671dfaa865b
98356b03-d851-4963-8608-2508b3e3d21b,2023-09-20,No comment,4WA0YY7HX63,4,24cb7512-6d2b-4723-ba96-c9149056c8cf
2b237214-ebc0-41cf-98ce-2399c6998b20,2023-05-03,"Impressed beyond words, flawless product",8QP9P86UH73,5,251d7b7d-7fd6-415d-8c40-96e6575dac98
a5ad65bd-0afc-4683-b71c-f7c17f98f2c8,2023-03-20,The product's advertised safety features were inadequate and unreliable,4DA2QM4VC71,2,264eba37-9deb-4f19-a53b-5563a2754cf8
aebcbb95-b118-489c-b02d-bf7540007610,2023-03-29,"This product has made my life so much easier, I'm grateful for it",3UQ6JC1FJ55,4,267a8e6c-a560-4059-9fe7-4288b9fd8df5
e1949d79-a135-4c04-a085-f058938a2833,2023-03-23,The product is exactly as described and works perfectly,2E76FW6YE98,4,2688a7de-b55d-446b-941b-e14b53e82766
e024528c-e62e-4206-8bc4-8e791e342770,2023-07-07,"Very happy with the purchase, it's been a great addition to my routine",2FX6JU8DG51,4,26908641-c500-40ca-bee8-40d9bfec3b95
40959903-58aa-4eb1-90f3-8ca08f326b3f,2023-09-20,"It's okay, but I've seen similar products that are better",8C90K10FC31,3,26a62c82-fed2-4355-b02a-79c86e22c1b2
0b53d3ee-29ae-4b3b-9f80-4c159c9c5590,2023-11-17,No comment,9NY9U19DU27,3,26ab107a-d5e2-417c-91ff-0f1f0f2f64af
3c9629ba-0253-44a4-8807-8c9a8611a67c,2023-09-10,The product arrived quickly and was exactly as described,8DH9VN0XG54,4,28672f93-99e9-467a-94e7-11e3d2358f3b
0e04194d-bd15-441b-ab49-6784b5cf8eb7,2024-01-21,The product's design was impractical and didn't function as expected,9N80T26EC18,2,288ed371-8f1e-4fc6-a2e3-2991b9cac107
6acc0aa4-e72e-470f-9f46-0471feca206d,2024-01-21,"Delighted with this purchase, perfect product",6N52XT3EH05,5,289eff66-a6d0-41cf-b341-a0b71d150f3f
a1d674f9-9dfa-4244-9437-332796844338,2023-12-26,"Remarkable product, flawless in every aspect",4G53F37RT46,5,28b61c34-775f-43f5-a545-8bfa111cc916
33d72edd-0b32-4ab9-a421-0872c184bcc1,2023-07-15,No comment,8J42UQ1UW92,4,29262fb4-f2dc-45f9-8add-845cb344838d
