review_id,review_date,reviews,product_id,ratings,order_id
a114317c-29d0-408a-b73e-9d8e5296d1ac,2024-01-08,The product's assembly instructions were unclear and confusing,4GW3CF2HU62,2,29985456-ed14-46e7-be82-d4a5822efe1e
25c86c8a-274d-4761-896a-cd0e458de2f9,2023-07-29,"This product has been a game-changer for me, highly recommend",8TK5J17YT10,4,299a62e9-2d75-4ae6-ba11-156f615df51a
243effe8-50dd-48d5-b1fb-e375728449d9,2023-10-29,No comment,8U77VK4DD30,3,29de00f7-f6a6-4af0-a26d-81f971dd8a34
e5dc0627-6117-4709-8bd4-3f7f4e45af59,2023-11-22,The product was flimsy and didn't hold up well,1XA0EW8UP80,2,29e9c860-48df-40ae-bbd2-defafe43f40b
32bb10c2-9c97-4973-94f5-af73c53b07d4,2023-11-06,"It's acceptable, but it's nothing to write home about",8JW2NA1MQ31,3,29ec4f18-037c-452a-9ab7-80f0cf723753
d3c488f6-f604-47dd-b75f-44ab4df26449,2023-06-16,"Phenomenal quality, 5 stars all the way",2T90VF0KG67,5,29edabc1-c751-4fbf-87b6-9daa4696e1c1
93081d57-6e4d-48f7-b74f-12833369ee4e,2023-06-11,The product is reliable and has performed consistently well,5F59E61AF25,4,2a34c773-a085-47ed-93dd-661a88ff9251
1ef5a90b-030d-446a-b225-70acf6251c79,2023-09-07,"It's acceptable quality, but there are better choices available",8YK2FC0CD91,3,2a61a2e8-756a-4354-907b-b6d5d173a7df
8fe5d937-11a6-41d7-b252-6b5c1f2b4895,2024-02-03,"Exceeded all expectations, highly satisfied",5HU4HW2JM72,5,2a7db6dc-b348-4cfd-9f3a-a21ad4c543ec
e4ea26b5-17f1-4ffb-97a3-cf519638eb4a,2023-11-12,"Perfect in every way, couldn't be happier",2AQ4RA9WC95,5,2ad98fd6-b684-46d9-a08d-dc07a3a7c880
b5e9e56b-7dd5-447f-b7ec-146a585c4e77,2023-08-27,"Flawless product, highly impressed",3QF3FJ5EU94,5,2bd69aae-866c-4c29-8193-6c478ede9d7f
9f8f866e-2022-475a-a36b-45806c07b078,2023-06-12,"It's acceptable quality, but there are better choices available",4JY1FV4MH33,3,2c8a41c5-6add-41bb-8647-1769c1412cc5
5ad9cc80-6f81-434a-8668-2712dc4124c2,2023-05-18,"The product's advertised compatibility was incorrect, didn't work with intended devices",7DW4G31GN88,2,2c909241-7930-4a15-9efd-6a6ed3850924
ac210af7-9308-4c06-8050-30bd0a139247,2023-12-14,"It's a great value for the price, highly recommend",3VV2N61QQ93,4,2cd5989c-efc1-4476-98e0-d78635e11463
89e30fab-4298-402f-bb6f-66752d8d90ff,2023-09-12,"Perfect in every way, couldn't be happier",5RP2HA7XD88,5,2d908379-37e8-40dd-839a-2724dff02ba7
d892f630-d09d-4803-823d-2a0f46e827da,2023-05-16,Product didn't match the images online,2N80F38PP37,1,2e406a70-eaea-4099-a8a5-d89578cab78b
e9136312-7a97-4f92-ba36-825b13f954a0,2023-03-16,No comment,1WH9JU6CN73,3,2e5e87e2-f195-43d8-b2ab-018fdf6d2b44
8ac7154c-9182-4bb2-8546-80172257f559,2023-05-22,"Didn't receive the complete order, missing items",5QM6RD9XU64,1,2e98b09d-3216-495f-839e-6d4318c16083
8f27f5d8-4077-4678-ad5f-0ae24efc9c9f,2023-12-20,Item was scratched and looked second-hand,5J29RW9EP00,1,2ef7e757-9925-4b6d-b471-d6e121a6f077
2afe9342-5bc2-46c9-82b3-96fae3a42088,2023-05-07,The product's advertised customer support was nonexistent or unresponsive,8RE1K18JD08,2,2fbe07f7-8034-4bf2-ab70-a1d9f1d9b75e
9b04151d-be8a-4b83-81b7-3ccf8a268151,2023-06-24,No comment,4QJ0JG4KR87,5,2ffc976d-efa9-4bf5-9275-74cd1ed10ddd
c065483b-01aa-48d4-8579-9a9e8900bdc9,2024-02-25,"Remarkable product, couldn't be happier",3KU0CU2KM41,5,2ffee9c6-be40-4dea-bb26-757d9e08aa1f
46a190a2-d602-495d-9399-b58f42941d72,2024-02-16,"It's okay for everyday use, but don't expect anything special",7VJ6XJ2YF36,3,302a9db4-8cb8-4df8-a2d5-624fe6fdb8ef
c3ac7499-148d-43d9-bf3d-a68401a7831c,2023-05-14,"It's average, meets expectations but doesn't go above and beyond",3HY3N10KG62,3,30a46ac9-d82a-433e-90db-02d7ad4fffcc
0ebd7089-1ebe-42d7-b3a8-24aa47f36199,2023-06-23,No comment,9M18TN6WH22,4,30b9247d-ad22-4952-8df3-4b2da5678bef
2387cb3b-0705-4d02-8478-55f756b7e423,2024-02-03,No comment,8VY8GV0JY38,4,30be5f03-b084-4d66-81e1-d971b007205d
f429d587-43ea-4589-801c-54e1bd1ebf69,2024-01-12,No comment,1K69WR7QD83,5,31146ac6-a8be-4911-b340-2ff027f4fb2a
daf70ed6-7c6d-4b87-adf1-45ee939be765,2023-12-19,"It's a great value for the price, highly recommend",2M07RJ0XF27,4,313fffcd-9e0d-4d03-9068-014a24f558d0
78838936-39a3-41b0-82ee-0cc77125524c,2023-07-24,The product had missing parts and couldn't be assembled properly,6C91Y31QY35,2,31e36f56-ddb9-46b9-9063-b75a2f3921e3
4cf59093-98ef-4a73-8654-7ea4f608171c,2023-05-14,"Amazing quality, couldn't be happier",7T90KG3ED20,5,32c50aa6-a514-4e82-abd3-b350a8793e76
bca93e49-641c-4084-8330-88398df0570c,2023-09-19,The product was falsely advertised as eco-friendly but wasn't recyclable,3MU3UX0CD24,2,3332fb8f-aa66-469c-bdf1-084f39fb67b4
9e3a7837-ceac-4acf-9c8c-1c02636dcb5a,2023-06-15,It's a solid product that does what it's supposed to,4N97U56ME02,4,335dd0a0-cd7c-4f0a-946a-d18c94416260
4618bc7c-b092-43e7-be20-67a0c38b2fbd,2023-10-14,No comment,7WA4RJ0NC67,5,338e5dfd-8a5e-4b61-bc1c-577f44dffacf
f2f614a4-e638-46fd-a098-4020db55dd51,2023-12-20,"It's passable, but there are definitely superior options out there",1KU4PN8FU70,3,33c6c8e9-44cb-46ed-ac4b-32ea42927440
86e505ea-471e-4ed6-8ea2-6f012ff8851b,2023-03-24,No comment,5U52EK3YU02,4,33d99b95-4133-46ce-b69a-14634e6ef75a
1875eabe-d9e4-42af-b0f3-d6ae981eceef,2024-02-28,The product's packaging was difficult to open and resulted in damage to the item,9DE8F03CM88,2,33de08ab-542d-4a11-b2ed-f321fe3da7fe
a6e73cfb-bd35-483d-b9b8-048e62fe2239,2023-12-20,"The product had scratches and dents, clearly not new",4CW5UP7QD44,1,340965fa-4637-4ed6-9c63-290efc4451dd
98a61a5a-066f-4a98-a6e3-11a6bc006e85,2023-12-16,"Outstanding product, couldn't be happier",4VV2QF4QF87,5,348cddc1-3e0b-4548-b768-0fb2b1c11b9d
7e4903fb-6c18-4c98-aece-22eabed04cc2,2023-07-31,It's a reliable product that I can count on,5Y55K16WV99,4,352da304-48ba-469c-baf3-cfdc993b4abb
b3294603-3159-4a12-938c-f0dc8fd003d2,2024-01-10,"The product had a cheap, plastic feel despite being advertised as high-quality",3R45T77QQ75,2,36242c21-6183-45fa-b921-e0d8070d56d9
913ee765-baf3-4094-821d-c20d1a8c7648,2023-04-04,"The product's warranty was misleading, couldn't get a refund or replacement",5GW4Q24HM12,2,362c3a68-e425-4f71-bf89-3d255c9eebf6
07c80b65-24ac-4edd-ace3-5ac7c8df4982,2024-01-20,"Extremely slow shipping, took forever to arrive",9TD4D92YD87,1,36e52789-c0fd-4be1-b08e-19d5e1bc88bb
5970d781-0582-4bdf-b867-0331e85363ae,2023-03-11,"Excellent product, would definitely buy again",7G13MC0JY01,4,37140132-55e4-44cc-afee-315f5e503a6c
68604ffa-50d7-4baf-b68d-b008ed398564,2023-11-16,The product's material was cheap and uncomfortable against the skin,6RF5GV2JF09,2,372c6a7f-7893-4039-ae46-65a22bb147be
999efad4-9d11-4bc5-9714-a61ac43d4e9d,2024-02-15,"Remarkable product, 5 stars all the way",4R40D92HK27,5,372ddeb9-8566-4b50-ab2a-c29e1dd7b63d
02a1eba6-3ffc-400c-a959-c3d9cb160df5,2023-10-08,"Fantastic quality, highly recommended",9YC6WQ9QR18,5,37545e88-5caa-41b2-9430-f47ada480d14
724faea0-2f5c-44f9-8bb9-05a86419282b,2023-06-26,"Flawless product, exceeded expectations",6HP6PN8HR49,5,379ccf8e-cd3f-49cb-8275-4ccf15a181c3
78e85577-1192-470d-880c-7c8300ee785b,2023-03-23,"Perfect in every way, highly satisfied",6C84UT4PC91,5,37cf60f4-ff7f-4e9a-8852-5531156a921f
7508180a-c42c-46a9-bdee-9596cf954608,2023-12-14,"Delighted with this purchase, perfect product",6F96NR4QY05,5,37f6713d-6759-4943-b437-0e98b97ece48
52241804-b622-456a-b750-2b13dd41fae3,2023-05-07,"It's a great value for the price, highly recommend",7KN6VV9CC93,4,38111950-59e2-439d-ad3e-b20c0c2969ef
030fb104-79c0-4ef0-a49b-7df0b902fa20,2023-10-08,The product was overpriced for its quality,9XT5R51AV31,1,38219195-5981-4641-9b3d-999c9768fb10
985355a3-371f-46ec-8fa8-971674e1eee8,2023-06-16,No comment,4W28GN6RM58,5,388f7fe2-2164-467b-b3ec-daadbc6dcb0f
56e79312-1f89-40a8-afe1-639b9fea486e,2023-03-30,"It's decent, but there are some flaws that could be addressed",7HR0PQ5VU71,3,391013d6-1741-40fb-94af-7157e97a72c9
3829bf0a-02e1-48c0-9c4c-edd653b3209e,2023-04-03,No comment,8G91U37YX34,4,39760aaf-b28c-46bf-9401-3dc099c80742
07c66e7d-7e71-4e26-8ca3-f09f087c030a,2023-11-11,Received a completely different product than what was ordered,9TT6V86CX90,1,39b10e8a-95a0-4a90-84b6-7f724b6f3f6f
a0a0d78e-f7be-4786-8b20-fda6996aa13b,2023-10-26,The product was advertised as durable but broke easily,4HE8JK5AD84,2,39e1ad80-f87e-4ec3-9e5f-a48c237e4b77
97e53a22-5aa2-45aa-b014-66d5e3139eed,2023-04-03,I'm satisfied with the quality and performance of the product,4WE9DV6GK07,4,3a0ba63c-63c5-4570-be48-9402dce8b8aa
554aef58-8939-4cd9-8df9-cd2fdbf775c7,2023-09-01,No comment,7JA5P84ND56,4,3a0c3604-e93f-48f5-afc2-905509742075
af2bb10d-5134-4bb5-a836-9be1c00943ef,2023-03-05,No comment,3UQ6JC1FJ55,4,3a136a48-34c3-4d34-99d5-087b3f8a3f12
252213b3-6de8-4501-ac82-90f0cf6926eb,2023-05-25,"It's okay, but there are definitely nicer options available",8TX8T46QF24,3,3a38e5da-164f-44d8-bbc0-c5b52734fe77
df31bce9-f577-4ea0-b3f0-99883f503ed4,2023-10-22,I'm impressed with how well this product has held up over time,2G08AR3RT08,4,3a721a56-25a3-444f-9e8c-96d4599befc5
1cdd421d-cd41-49d5-883c-a2b9b25ba02e,2023-07-08,"The product is average, neither great nor terrible",8YX4VY7CV78,3,3af17145-2fd0-4b7a-a333-12d0957d9f76
12560d20-87d7-474c-8db4-c7865ec2f4ec,2023-07-21,"Amazing value for money, flawless product",9JF1GA2NT90,5,3afe78c6-c05a-442d-a130-90aa249f2480
41cca870-9ea8-4a85-b1dd-d92201a7059c,2023-11-16,"Horrendous shipping costs, almost as much as the product",8A85C75WK92,1,3b6745da-2e55-4163-acb7-c75412f03fe9
ccb67161-6531-41e3-b005-4ef436091377,2023-07-02,No comment,2Y16P80JX37,4,3b7e0324-5f7b-4cef-b036-db6b8088f847
bb23721a-5cfa-439b-a9c4-9a36b73a8393,2023-07-17,No comment,3N92UU3KG10,3,3bc2b51d-ad0a-4fe8-bf0e-099bd100ffcf
2988c4e2-f902-478b-855a-1a136d8aa324,2023-07-17,"Customer service was impossible to reach, no phone support",8T40TJ8WA84,1,3c40b211-63b7-49f4-95ca-a8c23d442eaa
9e566d8b-78fe-410c-8ba6-2fed1548696b,2023-10-05,It's a reliable product that I've been very happy with,4N11CJ2CX58,4,3c8815d4-c5da-4788-b532-90f76b97423e
2168bc8f-1481-4534-8a98-1940a98319e3,2023-05-29,No comment,8XE6XV0DA95,3,3cfc67cb-62f4-4139-9591-e9b6e2d1d13b
80f69524-1e15-4fc1-a959-925e5fcae532,2023-03-24,"Exceptional product, highly recommend",5XA1DC9TW91,5,3d593659-6673-4b30-ae2c-888f83762bc9
530ff8e3-dd29-477c-b99d-f4bc722daf1a,2023-07-02,The product's colors faded quickly after just a few washes,7KK4QD6VJ27,2,3de0fafe-ca5d-4cef-a477-18aec15ea39b
2faf617f-9385-413d-81c3-6956ae484b82,2023-10-10,No comment,8M18DR7WK77,4,3e11cc05-0e8e-470b-84e0-518d1c696ce3
5f338ea6-4f99-4823-bc5a-44bd950fea6a,2023-10-04,"Delighted with this purchase, 5 stars all the way",7D09QR6MQ04,5,3f31a80f-5843-4cb0-9e5c-f98a6dde3371
31d2202c-e9dd-4bda-aab2-32d3219cd21e,2023-11-11,"It's an average product, meets expectations but doesn't exceed them",8K16YR8YR84,3,3f7335cb-40cd-4c1f-87bd-6b2f13e39920
c0f8b45e-8a6b-41c4-aadc-1abb1c0ff87b,2023-05-24,No comment,3K83WG9RR83,4,40138ed6-3cac-4d6d-af24-8f072ea7633d
07f65738-3de6-4d33-89fc-946ada6e23ba,2023-04-26,"Difficult to assemble, instructions were unclear",9T24WQ4AW08,1,402ecbfb-22df-4da4-98f7-1239c5b7a7ae
92ef0ecc-b685-4605-9f57-b9f903c6582b,2023-03-06,No comment,5F99RY9HY69,5,404a857a-e1ae-4341-9cc5-df0ab929e6c8
b25143ef-5a68-48d4-90f7-00dc8117caf3,2023-10-22,"Delighted with this purchase, perfect product",3T51WE8RV59,5,404f8892-2f7d-4400-adbf-d9ee6aacf8f5
61be6025-9b6b-46a7-933c-7ec6769333f3,2023-07-05,I'm happy with the performance and reliability of the product,7AA8AU5JW27,4,40961905-e3c0-4e00-9637-5432ed22603b
f312fd00-faa4-4d21-bf0c-0578c4f06fde,2024-02-01,No comment,1KT1CG4EU68,5,411e7c70-24ac-4ae5-87de-e9345edbcebf
8119a4cd-36b8-407c-a345-7b8a8f6fc3d1,2023-11-05,"Exceeded all expectations, 5 stars",5XA1DC9TW91,5,414e4f38-1c2b-4b49-972b-8bf1a230d926
a8f2c63b-5624-4182-8ea3-1cd5fee4aa3f,2023-09-01,"Impressed beyond words, 5 stars",3Y96T56ME51,5,41aba31f-160e-46ac-a082-69b8f13727fa
63a2a636-7e33-4db3-9565-9710fa3eb247,2024-01-24,"It's a middle-of-the-road product, neither impressive nor disappointing",6XD5GJ7AK48,3,4293e789-1940-4139-b3b8-34c6c2aa59cd
eeb24d83-e9cf-4de0-b391-65e0fe6d61c1,2023-08-06,No comment,1TT9QH4NY95,5,4294e2c5-5b9a-4669-9116-c5c00d42f701
57f9684b-649e-44a6-a72f-756d0267cac1,2023-09-25,"Phenomenal quality, highly satisfied",7HN1XV6UG72,5,42c63165-90b2-47dd-8dbb-2e7b3efb8bc4
95012ce4-b54b-439f-9d09-0d51f0f3da72,2024-02-22,"Perfect in every way, 5 stars",5CY7M41EK82,5,43455077-cc75-405f-9ca0-7e907743b807
c099f326-94ff-40c4-b332-67f8393eb739,2023-10-16,No comment,3KK7C45QD90,3,43463aeb-8da1-4fcb-b2cb-1d32ec5f3c3f
f7cec9dd-f568-4ac8-8d7d-f632b640fcc8,2023-04-26,"Thrilled with the quality, exceeded expectations",1F11VK4RQ38,5,4398f5a0-6b04-470d-9718-ad8dda5be704
910fea7d-170d-455f-89cd-c9d6ff8c1b1d,2024-01-15,"Flawless product, highly satisfied",5H28Q77YH37,5,43c55d69-3220-45cd-b0ce-66a8864096ca
c539efc0-7717-4220-a438-dd206ad000d6,2023-10-31,"Couldn't be more pleased, 5 stars",3H19RN0GH24,5,43cf0163-37b7-469c-b0e5-9e46069bc5dd
4c6312f9-4ccb-4f61-9908-431e7230971f,2023-03-17,"Phenomenal product, highly impressed",7TK9HX8JK43,5,43d556d0-352d-43f4-a12e-4b57acce665a
e043e47e-73e0-4135-b326-c67c2ba6b132,2023-03-23,"The product was over-hyped, didn't live up to expectations",2EQ5WP3MN59,1,43e72366-911f-49c1-8a2f-17ec9c049c83
8b495312-efa7-4e57-84a6-1c2205ccbcdf,2023-10-21,"Outstanding value for money, 5 stars",5PY8YH2VC89,5,43fdd78d-c617-4b03-bf31-56e3412b2f97
3c254ebe-17e8-4bbf-a11f-d500eddc3e68,2023-11-20,"The quality of the product is top-notch, very impressed",8DV4JJ5MJ82,4,44365432-301b-46c6-b588-e788c2368bdd
29d9836f-cb3d-4cd3-bb96-31e759fc85b1,2023-07-18,"It's decent, but I've seen better quality elsewhere",8RH8Y85WE70,3,44680a38-34ce-4040-abb1-3f4d65b5ad44
60246df3-0208-4e78-a82e-936a5144b23d,2023-03-24,"Flawless product, highly satisfied",7CM8R02MK19,5,44730fa7-09bf-4e6a-9ed3-323dd95e0a25
d281054f-35b7-4b7c-9a29-9596e1d29e79,2023-08-22,"Thrilled with the quality, exceeded expectations",2TM6HG5AA99,5,44a57c07-45b4-442f-a0ae-b4733e6062dd
5ef96875-5eb3-47c5-93b9-0c263af4da2a,2023-12-06,It's a fantastic product that I've been very pleased with,7D19XV1TU69,4,45c9a8dd-8f45-4caa-81d0-dab032649517
74d81da5-b9db-469c-9bf0-9ffc9616c3a0,2023-07-12,"Phenomenal product, highly impressed",6F96NR4QY05,5,462dc240-1fef-4d7c-86d5-2e770d4818e2
1d61465c-6ac7-4782-96bf-406d3e62547a,2023-08-23,The product was poorly designed and didn't function properly,8YX3V11WQ29,2,485589fc-2a72-45f9-91d1-c58be1f1e90b
a23335ea-5c97-4b87-bd0c-77c5a7e93c33,2023-04-16,"It's average, meets expectations but doesn't go above and beyond",4FJ8X96PE09,3,4865492e-9db0-4e56-ab6c-6f4ca435d316
ebfccaa1-e3d3-4c80-a1b5-f25c1f224f94,2023-08-26,"It's passable, but there are definitely nicer options out there",1VP3X75GX09,3,48b451c6-6d7f-4cc0-950c-3b989329e984
970ef6fd-25ff-49b2-9cd1-ed8259e2fad8,2023-07-02,"Perfect in every way, highly recommend",4XF8TG5CD85,5,49104769-95de-4913-9c52-589360e07137
8fa276de-aa2b-46c3-b71b-dbd344319202,2023-04-19,"Exceptional value for money, 5 stars",5J15H38WH46,5,4911da5c-4e2b-4377-a60c-2fdddccdd9b1
c989eb8d-656b-42de-b8ae-0e032338090d,2023-06-07,"Very happy with the purchase, it's been a great addition to my routine",3EC9EY7UV30,4,491538e7-43cf-4a84-90e0-40a03049cd73
785ff311-7d6a-4208-9a54-d84616876f79,2023-07-01,No comment,6CT0GT3GM72,4,49372941-3257-4e8f-89ea-6b0367fae902
f5637e5c-6235-42be-b142-cdf5955c801f,2024-02-18,The product's advertised compatibility with other products was nonexistent,1H07DF7PP71,2,497d39e0-bfc6-4e9a-a9c3-7c613f1c3ab4
121d311e-677b-44df-aa05-50e9ae22ff1c,2024-01-14,No comment,9JN8TA8RT22,5,498e7172-0690-415d-90a9-0e25935f05f1
4178b601-fd51-4f7e-b1cb-51755516ac54,2023-10-23,No comment,8AT0WD1CV64,4,4a18f5df-3536-4059-bfab-0f7b567c873e
462f5096-3c85-4198-a3e9-f8ac4baab674,2024-02-06,The product was advertised with misleading photos,7W90KM8PY34,2,4a2c62b4-383f-4b18-af2e-f2f2e4a26827
c92cffd6-a32d-4529-a6ce-3497f76156e1,2023-09-21,"Couldn't be more satisfied, 5 stars",3F25KA6UD17,5,4a8f189b-1dea-4ffd-8e4d-905546656a69
b1fdcc1e-967f-4505-98dd-0af532132224,2023-09-25,"It's a great product for the price, definitely recommend",3U00EQ5YG87,4,4af3cdb6-cdd0-4e5b-aa0f-8506872ac348
5f3dd98a-7379-45a0-a148-4cf54dcb3e58,2023-04-02,No comment,7CM8R02MK19,4,4b0faa33-1574-41ab-a7ae-f8aa0ec37eab
ea622353-4869-49dc-b97a-a166bcaf864b,2023-03-12,"Couldn't be happier with this purchase, outstanding quality",1VY5X56HD78,5,4b11ac3e-c052-4376-a121-03912ce9d16b
492c076a-fd75-4f2a-bbda-bc003fb6cb37,2023-05-06,"Perfect in every way, highly recommend",7TY5JN6EP00,5,4b350a22-4604-4e30-a674-ff8def9705a7
8d8e00e9-c5d0-46fa-a086-4232772dc702,2023-12-23,No comment,5JY2TX8EV42,3,4bea50d5-8b3e-4a7b-ab70-b3029928242a
05d13584-0f67-432b-b1f7-d8e0f9ff17bc,2023-06-12,No comment,9V31PP3AF18,5,4bee3f6d-0268-48ea-a805-437a71b1a61e
abbbbac7-8cff-4809-bfb0-a25eaa17cbde,2023-11-16,"Impressed beyond words, outstanding quality",3VV2N61QQ93,5,4c044531-dab0-40bc-a744-10c65df72340
d2f63a7e-f363-49cf-91e8-f71f4ae4741e,2023-10-29,"Excellent product, would definitely buy again",2TF3VW5FK41,4,4c28d405-8514-4639-8ffb-672657cab3bf
7b0d3e93-0b3a-4306-9eb1-5478365db0ec,2023-11-19,It's a versatile product that has been very useful to me,6AM0UD3GR27,4,4cf7cf3d-985e-4038-b71f-a3ff97535eac
e6318c97-6d03-470b-888f-30a6b6ba4a4c,2023-05-11,"Phenomenal quality, couldn't be happier",1X88NM1JN79,5,4d7a92a6-9989-44ee-ad1a-6732207faeb0
c64ae670-dbeb-4753-881d-3e9d844f9bf5,2024-02-08,"Remarkable product, flawless in every aspect",3GV7G81TW32,5,4dc5ba31-5184-4738-b02e-484960fa98cb
16cd0b76-34cf-406d-b4c8-385bbcdc4678,2023-04-17,"Phenomenal product, highly impressed",9E05YV9HP95,5,4dd208be-b059-4356-a17e-92ce8a1bc1d4
b26e3554-5374-4b0b-a78a-90dfc7cc601f,2023-12-10,The product's advertised durability was quickly disproven by wear and tear,3RR3A53MN86,2,4e2823f8-7a4a-4476-8879-4beebc92d0e3
d298b37e-2e23-4c7a-9944-47f15b0dc904,2023-03-29,"Thrilled with this product, 5 stars",2TJ3M64NW79,5,4ecb3f14-67d3-40bc-bad2-5701ded6c0ca
32bbf5be-b0e1-45d4-a85b-c643e95e7bb1,2023-07-05,No comment,8J89FN7UP81,4,4ef465eb-f76d-4ebd-8815-1d5fd595a5c0
f19386df-f971-4ac4-8326-305bec6e51ad,2023-06-24,"It's adequate for basic needs, but there are some drawbacks",1KY4KP6FT10,3,4f09fadc-d1d2-43f7-894e-2d365deb89ab
469fa4ae-7e96-48f6-9a69-0976097e51af,2023-06-02,No comment,7W32QJ2AM21,5,4f440ea1-49e0-41b5-8aba-47a020de9ae6
13b523c5-0f35-4af4-a8c8-d0f75f055b22,2023-07-07,No comment,9FF4T49MR05,3,5041986e-9007-40e3-9555-6a3bee54a0f5
b77c76b2-cfd3-4da2-bc11-747a6f001c0c,2023-05-02,I'm satisfied with the durability and performance of the product,3PQ4YQ9XV54,4,50ea3db8-4e01-4379-87fb-d720cde4a1b4
a6e9f0d1-6629-41de-a354-b8d386ac9d4f,2024-01-01,"Remarkable product, flawless in every aspect",4CD1EY4RX88,5,51079401-947c-4c04-8d9d-c461b95225b6
7bb22b0d-2259-4319-be04-cb6412df2e48,2023-12-11,"Exceptional value for money, 5 stars",5YK0D15FA43,5,512984e3-c6e5-4b3b-a705-d7bafe71cd95
d57b2225-d441-4042-86a5-0356ccec678a,2023-09-27,The product is well-designed and functions smoothly,2R10EN4AH96,4,51814322-e8ea-4855-a291-21760f83c1e6
d760e4c9-8f0f-4081-9add-1a21245a38fe,2023-03-06,No comment,2Q28TC8FT46,4,51ae41aa-96c7-45b1-aa71-4b4f260ea6ef
a15f11a1-5599-4a71-8721-f434c9e7ec17,2023-10-01,"Impressed beyond words, flawless product",4G53F37RT46,5,51c12eb1-9605-4052-8572-8aea0e96d470
c458bfd1-3a9f-4b01-9796-d0d2ac7f6507,2023-08-08,"Outstanding quality, couldn't be happier",3HR9T87HN01,5,51d12302-cc87-4894-a2a6-762a194fcd2d
895b3b36-7dab-45a2-94ba-8fba30debb83,2023-10-29,"Perfect in every way, couldn't be happier",5RQ1Y86EW30,5,523235c4-9b3d-413d-a8e0-0f78712fac6c
e64cd14b-c122-4814-8ae2-06778167d9a1,2024-01-08,I'm happy with the purchase and would buy again,1X64QT8GP72,4,5240f33c-901d-4719-96f8-873b0a8cb5c3
08f1679a-0333-492c-80e4-f73c9af051d6,2023-07-13,It's a fantastic product that I've been very pleased with,9QM1Y50DE26,4,525e8731-42cd-4ea5-ba7e-565bc4c67a28
2ca24ff1-6d38-49d0-adba-c3192386f615,2023-11-16,I'm impressed with how well this product has held up over time,8N48K13NH81,4,535b058a-8dda-4d2f-a2eb-562898920871
97c9fc63-9f7f-4b6a-b84b-160608ad0f07,2023-03-17,No comment,4WF0MU0DU65,5,53a1bdf1-7943-44cd-aecc-fffa7c453d13
dcfa28ee-1db6-45cd-8a68-fe6462829eb9,2023-07-16,"This product has exceeded my expectations, very satisfied",2GX7HN1HG81,4,53bed10b-1ac4-4844-b1f0-48e8ff72a864
05dae30c-154d-478e-8e90-058dd2f41de2,2023-09-21,No comment,9V04GW8VU41,4,540b17b0-246a-470e-a502-5c37fd36c669
74544549-9857-4082-855c-88354542641a,2024-02-08,The product arrived damaged and couldn't be salvaged,6FU9YR4DJ53,2,544352bd-8ce5-4361-b24d-26dded62f946
f0bac482-dd85-434c-9be6-3d0b27d9304b,2023-06-05,I've had a positive experience with this product overall,1PV1YY8VP72,4,5480938b-30a0-4a89-94d5-892e653e012a
ef9b4da2-b093-4ce0-9af0-8c6e8364fd43,2023-10-03,"It's average quality, nothing to write home about",1RH8MJ7TY00,3,54a1cab8-f91c-4643-a537-2389740d45c1
a045356d-b31e-4f0d-a739-160ee26de533,2023-12-18,"Impressed beyond words, remarkable product",4HY3UV0DE84,5,54af6213-081b-4619-abfb-10aa0337a203
f5c67d43-90d9-4c4c-a0f5-e999d9abe955,2023-06-08,"It's a great product for the price, definitely recommend",1G44EJ8TJ08,4,54f984e6-a725-4c43-b236-905421e3716d
237bea71-f6c3-4b92-bfaa-5f0d54107106,2023-07-08,No comment,8VY8GV0JY38,4,55a883f6-05af-4b38-8aff-817e263f65e8
0b853865-fb40-4afe-9feb-0e307f1cb257,2023-08-20,I've had a positive experience with this product overall,9NT8MY7YJ09,4,55b78c96-8e9c-4ddf-9593-00ae8ef753e2
2a3e0687-ebad-40e0-a689-0d5f76c3deb6,2023-03-28,"Remarkable product, exceeded expectations",8RF8EF8RD05,5,55c421c0-a275-4365-b9eb-a2aed5fff181
03425db5-862c-40e5-b015-67bb4a930b52,2023-05-14,"Couldn't be happier with this purchase, flawless product",9X51WH6DA98,5,55d9d77c-3032-4f67-a5c8-74307e84164e
d5c46e48-0d35-46df-bb94-706de9bb2387,2023-04-28,"Exceeded all expectations, 5 stars",2QH2DW0HW49,5,561291bb-ba28-429f-af85-a5db323f3dc4
14d76894-4733-4658-840d-ee523d07ced5,2023-09-02,No comment,9EU9K95PG07,5,5658ddd9-6fb2-4466-b730-df3f493616c8
6e706db1-c445-4ed7-8326-e6b83f9bd959,2023-11-15,"The product was nothing like the picture, very misleading",6M32W77QE04,1,565b4daf-500c-44d3-925c-d40a3ab0f507
59fc197d-97f0-41db-a6b7-dde71f27b5c1,2023-08-23,Very impressed with the customer service and support,7FJ8UT4WU86,4,56a3c232-5215-465e-b54b-c76c9a329a8c
bda84a32-9924-4801-a936-a84bfdab1b62,2024-02-29,"It's decent, but I've seen better quality elsewhere",3MK4G07CW27,3,56a6fef9-3c54-4425-b4d6-dc817d6bab37
ef9db92e-ff75-4dea-8857-61d16d975897,2024-02-16,I'm happy with the quality and performance of the product,1R23DY0QV25,4,56b5aea1-9a87-41ec-8838-34a530798cc8
63bc02d7-aa3b-432b-b1b5-f91bcf3974d6,2023-04-13,"The quality of the product is top-notch, very impressed",6WC7WC7HJ83,4,5795eb3c-4acc-45a5-9a57-de8fd0d2a3cc
847e099e-ca18-4107-9d9d-10dc4c71c148,2023-07-28,The product is well-made and feels durable,5V72QU1VT04,4,579f58ac-e460-4b9f-9db5-ec706c87d7f1
c514c62b-f7f7-4290-a1cc-fb2b96f0f2e1,2023-06-16,No comment,3H19RN0GH24,5,57a88ebf-a649-4a62-8201-58b019261542
6977b530-8785-4586-9a18-342763ff446d,2023-03-15,No comment,6PQ0K75PP44,3,581e5d20-413f-48ab-bc3e-e1cf42e3e1a9
14c89953-564c-44b3-a36d-9dddf4b69344,2023-05-15,"Very satisfied with the purchase, it's been a great addition to my life",9EW2W90DW49,4,5830a991-fb90-4261-b990-ecad888c3038
e3da2b00-108c-48b4-ab5f-f452eb56e629,2023-11-23,"Delighted with this purchase, perfect product",2CQ8KU6VJ74,5,58fee6a9-9c0c-454a-8f99-50f219d0a8da
339e19f7-77f0-4286-9cc1-686eec4ef7c4,2024-02-23,The product is well-made and feels sturdy,8J59JK0QT54,4,59b03933-3925-496a-bd53-abc539d345d1
1892a873-e41b-4e79-b579-5363f7dc4836,2023-11-19,"Exceeded all expectations, highly satisfied",9CJ1Y13XC43,5,59e157f4-6b85-4cc2-80f1-144f191910da
1544e45c-c31d-446b-9528-76e52550aeaf,2023-10-29,No comment,9EG6H32AK72,5,5a7e6098-3db4-4d27-9359-7422db598b26
ec73be8c-e60a-4358-af48-2a9d5c9296e9,2023-05-31,No comment,1VA4GW7TK38,3,5a98cee6-9880-49fa-8ff0-e860ab27c6f2
2b3b9364-f27b-47d0-b39a-b52e89dcdf61,2023-08-04,I'm satisfied with the durability and performance of the product,8QJ4VQ1QG24,4,5a9c6301-9d60-4da5-90d1-daa360010fdb
9c9cbd90-3055-47ef-b02c-34a3b6a5bfc2,2023-06-12,The product's advertised capacity was much smaller than stated,4P04DE2TU61,2,5a9cf955-c339-46db-9a97-fd10573afd26
815cc8b4-f4a0-4d5a-80d2-d95b5149b64d,2023-09-01,"Outstanding product, highly recommend",5WU1TT1DU55,5,5aa11d2f-64dc-4010-8581-6cf2cbc8cbb0
8b6b2087-2568-4414-8195-390548e9a0cb,2023-11-21,"Couldn't be happier with this purchase, outstanding quality",5PV5D00DW17,5,5aa12cc8-3634-43ff-9ffe-91033cd75fbc
514ea915-4203-4fb6-bec2-173006cc4b66,2023-04-17,I'm impressed with how well this product works,7M38VY0DM42,4,5aa700dc-67c2-4b3f-a982-88c618ff5172
e4554e80-6742-42a1-992c-e46a6504198b,2023-08-12,No comment,2CP1RC9KY88,4,5ab938e7-fb45-42b3-86b2-773a9b6c3876
9d14193a-82c8-4937-9a6c-f9e6e1c4d6f9,2023-07-01,Didn't receive any updates on shipping status,4NV2ND4QK96,1,5ac30415-f4ad-44f8-a070-c55e9a717d03
30fc6202-039f-43bd-b6a7-47e088c04d27,2023-11-27,The product was missing crucial features,8KC0MY4AH53,1,5ac60e55-9bf9-49bf-af7d-02e9b3b912f4
850944c5-433c-448d-9a2a-0aca091ecf31,2023-11-14,"Absolutely flawless, couldn't be happier",5V16GF1RE57,5,5b05a975-0daa-4e6e-bc60-bcbb9c5651e4
507399a3-c05f-4724-82a9-9b80519116ad,2023-06-07,"Top-quality product, highly recommend",7MH7EK5AX15,5,5b0f6d58-1669-49e0-8fdb-0e0e28c672b0
c62d3c18-c02d-4b79-8614-ac6d115c552c,2023-04-23,No comment,3GX3EX4NF67,4,5b1fb205-885f-45b3-91f7-ab1cbae96557
8b7125c0-4f63-4908-95a1-e4a967654a00,2023-10-28,"Flawless product, exceeded expectations",5PV5D00DW17,5,5b7869aa-5c5d-49e0-87ec-0f3fb8e5a1a1
f03fe617-73bc-4188-a2e8-b24d67a5f791,2023-10-12,"Flawless product, couldn't be happier",1PW0T43NM59,5,5bbb496e-649d-4b54-a5fe-042642a3df7a
fea6816e-a33c-4a00-8a99-e2bb41e51104,2023-06-04,Poor communication about shipping delays,1D54NM0XV43,1,5c0bb2bd-bb51-4885-bc96-8b4767cb85fc
